conv_id	clause_no	context?	emotion?	chatbot?	clause	prob
155	11	False	False	True	but you know life really is too short.. 	[]
155	12	False	False	True	i think you should try to reach out! 	[]
155	13	False	False	True	Do it! 	[]
155	14	False	False	True	:) 	[]
156	0	True	False	False	My child lied to me , and went somewhere he shouldnt have went. 	[]
156	1	False	False	False	So I found something out the other night that made me extremely upset! 	[]
156	2	False	False	True	What happened?!	[]
156	3	False	False	False	My child went out behind my back, 	[]
156	4	False	False	False	and snuck out! 	[]
156	5	False	False	True	Oh no. 	[]
156	6	False	False	True	Guess they have finally reached that rebellious age. 	[]
156	7	False	False	True	What did you do?	[]
157	0	True	False	False	I saw that they are going to remake a movie I like a lot.	[]
157	1	False	False	False	So I just saw how they are going to have a remake of Fist of Fury.	[]
157	2	False	False	True	I have no idea what that is.	[]
157	3	False	True	False	It is a old movie that came out in the 80s. 	[0.8203321, 0.79401636, 0.5, 0.5]
157	4	False	True	False	I remember seeing it as a kid!	[0.8715516, 0.7914253, 0.5, 0.5, 0.5]
157	5	False	False	True	Oh is it and action movie.	[]
157	6	False	True	False	Yeah it is a old black and white Karate movie	[0.71724147, 0.5, 0.5, 0.5, 0.5, 0.5, 0.5]
158	0	True	True	False	There was once a mouse in my  kitchen. 	[]
158	1	True	False	False	I almost died.	[]
158	2	False	True	False	One time there was a large mouse in my kitchen.	[0.82614, 0.8398769, 0.8252063]
158	3	False	False	True	What did you do with it? 	[]
158	4	False	False	True	Did you try to kill it?	[]
158	5	False	False	False	I closed the door and put a towel under it. 	[]
158	6	False	True	False	IT was late so i couldn't call maintenence til thehmorning.	[0.77173257, 0.5, 0.5, 0.5, 0.5, 0.5, 0.5]
158	7	False	False	True	Thats what I would have done. 	[]
158	8	False	False	True	Did they get it taken care of?	[]
158	9	False	False	False	Yes. 	[]
158	10	False	False	False	He had chewed a hole under my sink so they boaded it up and put down traps.	[]
159	0	True	True	False	I think my job will lay us off. 	[]
159	1	False	True	False	I think our job might be laying us off. 	[0.7879883, 0.5]
159	2	False	False	True	O No! 	[]
159	3	False	False	True	Are they going to offer you any kind of package?	[]
159	4	False	True	False	Doubtful honestly.. 	[0.86118865, 0.6369587, 0.5, 0.5, 0.5]
159	5	False	True	False	they dont seem to care very much. 	[0.86595434, 0.6215793, 0.5, 0.5, 0.5, 0.5]
159	6	False	False	False	:/	[]
159	7	False	False	True	Im sorry to hear that. 	[]
159	8	False	False	True	Maybe you should contact your HR and see what your options are	[]
160	0	True	True	False	I finally rearranged the garage after a year of putting it off	[]
160	1	False	True	False	So after a year of being here we finally got to rearrange the garage.	[0.7432551, 0.5]
160	2	False	True	True	How is it looking? 	[0.85806435, 0.84160554, 0.71690637]
160	3	False	False	False	I think we will be able to get two cars in here now!	[]
160	4	False	True	True	There you go! 	[0.86961913, 0.7143452, 0.5, 0.5, 0.5]
160	5	False	True	True	Thats awesome.. 	[0.5814235, 0.5, 0.5, 0.5, 0.5, 0.5]
160	6	False	False	True	i really wish we had a garage. 	[]
160	7	False	True	True	lol lucky!	[0.87173617, 0.6977695, 0.8538364, 0.5, 0.5, 0.5, 0.5, 0.5]
161	0	True	True	False	I lost my cat to old age and cried all night about it.	[]
161	1	False	True	False	So my cat of 10 years past away last night. 	[0.79008025, 0.5]
161	2	False	False	False	I dont know what to do	[]
161	3	False	False	True	oh no. 	[]
161	4	False	False	True	I'm sorry to hear that.	[]
161	5	False	True	False	He is really old but I hate that it happened you know?	[0.8733901, 0.45901138, 0.5, 0.5, 0.5, 0.5]
161	6	False	False	True	OF course. 	[]
161	7	False	False	True	Pets are family.	[]
162	0	True	True	False	I always donate my change when I shop at my local drug store. 	[]
162	1	True	False	False	Makes me feel like I' doing something good.	[]
162	2	False	True	False	I like to give to charity.	[0.73701197, 0.5, 0.5]
162	3	False	True	True	What charities do you like to give too	[0.76282084, 0.5, 0.5, 0.5]
162	4	False	True	False	Whatever my local pharmacy is giving to at the time. 	[0.8333157, 0.8564524, 0.5, 0.5, 0.5]
162	5	False	True	False	I donate my change since I shop there a lot. 	[0.77534163, 0.81666076, 0.8568895, 0.84444785, 0.84957993, 0.8307703]
162	6	False	True	False	It adds up.	[0.71788263, 0.5, 0.5, 0.5, 0.5, 0.5, 0.5]
162	7	False	True	True	That is a very nice thing to do, 	[0.8613921, 0.79072064, 0.5, 0.5, 0.5, 0.5, 0.5, 0.5]
162	8	False	True	True	I wish I could do more to help.	[0.6642913, 0.5, 0.5, 0.5, 0.5, 0.5, 0.5, 0.5, 0.5]
162	9	False	True	False	Every litlle bit counts. 	[0.7465862, 0.5, 0.5, 0.5, 0.5, 0.5, 0.5, 0.5, 0.5, 0.5]
162	10	False	True	False	Eventually I will be able to write a check.	[0.844188, 0.80467814, 0.79204375, 0.82891923, 0.8272491, 0.8089741, 0.5, 0.5, 0.5, 0.5, 0.5]
162	11	False	False	True	I just put all my change in a giant bottle.	[]
163	0	True	True	False	I lost my wallet and had to get all new cards	[]
163	1	False	False	False	So I lost my wallet and had to get a new ID issued to me.	[]
163	2	False	False	True	I hope someone turns it in soon to you.. 	[]
163	3	False	False	True	did you lose out on money too? 	[]
163	4	False	True	False	I usually dont have much cash on me but the cards are hard to replace.	[0.6903476, 0.5, 0.5, 0.5, 0.5]
163	5	False	True	True	Yeah a real pain honestly... 	[0.8647696, 0.804271, 0.5, 0.5, 0.5, 0.5]
163	6	False	True	True	im sorry that happened to you. 	[0.86403185, 0.8263427, 0.83747226, 0.8658745, 0.5, 0.5, 0.5]
163	7	False	False	True	:/ 	[]
164	0	True	True	False	to go to a concert. 	[]
164	1	False	True	False	Im going to my first concert this weekend. 	[0.7255512, 0.5]
164	2	False	True	False	Yesssssss! 	[0.8068313, 0.5, 0.5]
164	3	False	False	True	Did you buy tickets or win them?	[]
164	4	False	False	False	I bought them, 	[]
164	5	False	False	False	woulda been cool to win them though right? 	[]
164	6	False	False	False	lol 	[]
164	7	False	False	True	Yeah	[]
165	0	True	True	False	When the Falcons won the game I was excited.	[]
165	1	False	True	False	When the Falcons won the game I was excited.	[0.87429494, 0.73644197]
165	2	False	False	True	What game did they win?	[]
165	3	False	False	False	The NFC championship.	[]
165	4	False	False	True	Really? 	[]
165	5	False	False	True	I don't recall that at all. 	[]
165	6	False	False	True	I remember them choking. 	[]
165	7	False	False	True	I could be wrong.	[]
166	0	True	True	False	Our lights went out last week during a storm. 	[]
166	1	True	True	False	Its was only for 15 minutes but I was so scared.	[]
166	2	False	True	False	There was a big storm here last week.	[0.8256034, 0.5, 0.5]
166	3	False	False	True	That sucks. 	[]
166	4	False	False	True	Are you ok?	[]
166	5	False	True	False	The power went out for about 15 and scared the crap out of me, 	[0.6726351, 0.5, 0.5, 0.5, 0.5, 0.5]
166	6	False	False	False	but other than that we were fine.	[]
166	7	False	False	True	Thats good. 	[]
166	8	False	False	True	Did the clocks all reset?	[]
166	9	False	False	False	The ones I have back ups so they never went out.	[]
167	0	True	True	False	I was impressed by the new Tesla.	[]
167	1	False	True	False	I was impressed with the new Tesla that I test drove.	[0.86820626, 0.79913807]
167	2	False	False	True	I bet that was rather fun, 	[]
167	3	False	False	True	how fast did you get it going? 	[]
167	4	False	True	False	Over 100mph.	[0.7606893, 0.5, 0.5, 0.5, 0.5]
167	5	False	False	True	Wow! 	[]
167	6	False	False	True	You are crazy, 	[]
167	7	False	False	True	ha ha - i probably would have had a panic attack at 90MPH. 	[]
167	8	False	False	True	:p	[]
168	0	True	True	False	i changed my own oil 	[]
168	1	False	True	False	I managed to change the oil in my car on my own without breaking anything...	[0.8451168, 0.866841]
168	2	False	False	True	Thats great.I  change my oil all the time.	[]
168	3	False	True	False	I havent changed my oil in years since my dad taught me so... 	[0.8430927, 0.7898785, 0.5, 0.5]
168	4	False	True	False	it was an achievement for sure. 	[0.6817489, 0.5, 0.5, 0.5, 0.5]
168	5	False	True	True	Yes my dad taught me also.	[0.87236524, 0.7781367, 0.809943, 0.5, 0.5, 0.5]
169	0	True	True	False	I wish I had someone to spend my days with. 	[]
169	1	True	True	False	I feel a alone.	[]
169	2	False	False	False	I should really try to get a girlfriend or something. 	[]
169	3	False	False	False	I just need to feel someone.	[]
169	4	False	False	True	Try online dating! 	[]
169	5	False	False	True	Its actually really fun... 	[]
169	6	False	False	True	have you tried it? 	[]
169	7	False	True	False	Yeah I just feel like it is no use. 	[0.78430134, 0.5, 0.5, 0.5, 0.5, 0.5, 0.5, 0.5]
169	8	False	False	True	Dont feel that way... 	[]
169	9	False	False	True	theres someone out there for everyone. 	[]
169	10	False	False	True	Give it a try. 	[]
169	11	False	False	True	:) 	[]
169	12	False	False	False	OK I geuss I can try to apply myself more.	[]
170	0	True	False	False	when my daughter choked on a piece of food 	[]
170	1	False	True	False	The other day during breakfast my daughter started choking and I panicked. 	[0.74158293, 0.5]
170	2	False	False	True	Were you able to get her help in time! 	[]
170	3	False	False	True	How is she doing?	[]
170	4	False	True	False	Yeah I was able to get the food unlodged but wow it was super scary. 	[0.81176907, 0.8556419, 0.83612776, 0.85869074, 0.8669708]
170	5	False	False	False	Shes okay now thanks! 	[]
170	6	False	False	True	That is good to hear! 	[]
170	7	False	True	True	Yeah situations like that can be really alarming.	[0.77138704, 0.5, 0.5, 0.5, 0.5, 0.5, 0.5, 0.5]
171	0	True	True	False	I went to class and I brought extra supplies since I knew we had a test.	[]
171	1	False	True	False	It was for science but I had notes i had brought.	[0.83860606, 0.8558548]
171	2	False	False	True	Thats not right. 	[]
171	3	False	False	True	How did you feel?	[]
171	4	False	False	False	No we are allowed to bring notes it was just a surprise test. 	[]
171	5	False	False	False	I felt happy about being able to bring mine.	[]
171	6	False	False	True	That's good. 	[]
171	7	False	False	True	How did you do?	[]
171	8	False	False	False	I got a A! 	[]
171	9	False	False	False	the highest score in the class.	[]
172	0	True	True	False	I was sad when my grandma died.	[]
172	1	False	True	False	My grandma died. 	[0.8211616, 0.5]
172	2	False	True	False	I am so sad.	[0.65970284, 0.5, 0.5]
172	3	False	False	True	Im sorry to hear that. 	[]
172	4	False	True	True	Was it from age or complications?	[0.721109, 0.5, 0.5, 0.5, 0.5]
172	5	False	False	False	Age but she also smoked.	[]
172	6	False	False	True	Yeah that is not good. 	[]
172	7	False	False	True	But everyone does have a time to go you know?	[]
173	0	True	True	False	When I was little , I was afraid of the dark.	[]
173	1	False	True	False	I use to hate the dark when I was little.	[0.7052364, 0.5]
173	2	False	True	True	were you afraid of the dark?	[0.7515012, 0.84504086, 0.83834815]
173	3	False	False	False	Yes. 	[]
173	4	False	False	False	I had a nightlight to help.	[]
173	5	False	True	True	i slept in my mom's room because i was always afraid of the dark	[0.8427236, 0.8178416, 0.5, 0.5, 0.5, 0.5]
173	6	False	False	False	I was. 	[]
173	7	False	False	False	I use to have a nightlight to help.	[]
174	0	True	True	False	I went to a cheerleading event and a girl did a double backflip	[]
174	1	False	True	False	So I was at cheeleading last night and this girl did a double backflip!	[0.73023355, 0.5]
174	2	False	False	True	Did she land?	[]
174	3	False	False	False	Yeah! 	[]
174	4	False	True	False	It was just really fast and she went up really high!	[0.8701775, 0.71626246, 0.76157576, 0.84058315, 0.5]
174	5	False	True	True	Sweet. 	[0.84872246, 0.7718573, 0.5, 0.5, 0.5, 0.5]
174	6	False	True	True	Did the crowd cheer?	[0.8449461, 0.5, 0.5, 0.5, 0.5, 0.5, 0.5]
174	7	False	True	False	Everyone got on there feet and clapped for her. 	[0.78324974, 0.5, 0.5, 0.5, 0.5, 0.5, 0.5, 0.5]
174	8	False	False	False	She had to be only 10 or so.	[]
175	0	True	True	False	I was surprised when I was accepted into Harvard.	[]
175	1	False	False	False	I got into Harvard. 	[]
175	2	False	True	False	Can you believe it?	[0.7006374, 0.5, 0.5]
175	3	False	False	True	Wow that is great! 	[]
175	4	False	False	True	When are you going to start?	[]
175	5	False	False	False	In the Fall.	[]
175	6	False	False	True	That is really great! 	[]
175	7	False	False	True	How does that make you feel?	[]
176	0	True	True	False	my wife keeps giving our son a stick and he keeps hurting himslef.	[]
176	1	False	True	False	it annoys me that my wife keeps giving our son a stick even though he hurts himself every single time	[0.85070294, 0.74169743]
176	2	False	True	True	Why don't you say something?	[0.85454756, 0.8620951, 0.7795062]
176	3	False	False	False	i did, 	[]
176	4	False	True	False	she calls me a helicopter parent and just laughs at me	[0.7980751, 0.86404806, 0.5, 0.5, 0.5]
176	5	False	True	True	That isn't nice.	[0.78705245, 0.5, 0.5, 0.5, 0.5, 0.5]
177	0	True	True	False	I am afraid of clowns.	[]
177	1	False	True	False	I am afraid of clowns.	[0.75530136, 0.8537006]
177	2	False	False	True	oh gosh, 	[]
177	3	False	False	True	me too!! 	[]
177	4	False	False	True	especially the clown from the movie IT	[]
177	5	False	False	False	Yes I saw that movie and cried.	[]
177	6	False	True	True	i slept with a light on for a couple of night lol	[0.52893215, 0.5, 0.5, 0.5, 0.5, 0.5, 0.5]
178	0	True	True	False	I was attavked by seagulls on the balcony of a hotel last weekend. 	[]
178	1	True	False	False	I was eating crackers.	[]
178	2	False	False	False	I took a trip over the weekend where we stayed at a nice hotel with a balcony overlooking the pool.	[]
178	3	False	False	True	That sounds really nice! 	[]
178	4	False	False	True	Did you stay near the ocean?	[]
178	5	False	True	False	Yes in Biloxi. 	[0.8712502, 0.8686472, 0.4107328, 0.5, 0.5, 0.5]
178	6	False	True	False	The balcony had a downside though. 	[0.8471204, 0.8548922, 0.5, 0.5, 0.5, 0.5, 0.5]
178	7	False	True	False	The seagulls would always try to steal your food. 	[0.7359672, 0.5, 0.5, 0.5, 0.5, 0.5, 0.5, 0.5]
178	8	False	False	True	I remember throwing food over and watching them catch it as a kid.	[]
178	9	False	True	False	There were like 5 of them trying to steal my crackers. 	[0.8659877, 0.7503866, 0.5, 0.5, 0.5, 0.5, 0.5, 0.5, 0.5, 0.5]
178	10	False	True	False	I was scared.	[0.8649165, 0.79867667, 0.5, 0.5, 0.5, 0.5, 0.5, 0.5, 0.5, 0.5, 0.5]
179	0	True	True	False	I got in my car and my son left a note on my seat.	[]
179	1	False	True	False	When I got in my car to go to work I notcied a note on my seat.	[0.83236784, 0.84648955]
179	2	False	False	True	What did it say?	[]
179	3	False	False	False	It was from my 7 year old son, 	[]
179	4	False	False	False	He wanted to tell me he loved me and wished he could come work with me,	[]
179	5	False	False	True	That is so sweet. 	[]
179	6	False	False	True	Give him twenty dollars. 	[]
179	7	False	False	False	I think I am going to take him out for icecream.	[]
179	8	False	False	True	I bet he would love that.	[]
180	0	True	True	False	I am ashamed when I cheated on the test.	[]
180	1	False	True	False	I cheated on a test. 	[0.78276044, 0.86562866]
180	2	False	True	False	I am very ashamed.	[0.75760233, 0.5, 0.5]
180	3	False	False	True	oh no :( maybe you should confess and i'm sure you will feel better	[]
180	4	False	True	False	I would but I will get in trouble.	[0.8194367, 0.8338385, 0.864002, 0.7932602, 0.5]
180	5	False	False	True	i understand. 	[]
180	6	False	False	True	maybe next time you shouldn't cheay	[]
181	0	True	True	False	I'be been thinking a lot about my childhood lately , sort or reminiscing.	[]
181	1	False	True	False	I miss my family members as they all pretty much gone now...	[0.7905418, 0.5]
181	2	False	False	True	Sorry to hear that.	[]
181	3	False	False	False	Yeah, 	[]
181	4	False	True	False	as you get older you have to face the fact of loved ones not being around forever.	[0.7640551, 0.5, 0.5, 0.5, 0.5]
181	5	False	False	True	Yes. 	[]
181	6	False	True	True	I have lost my grandma.	[0.7642131, 0.5, 0.5, 0.5, 0.5, 0.5, 0.5]
181	7	False	False	False	My condolences to you...I hope you have wonderful memories of her!	[]
182	0	True	True	False	I am grateful to be alive.	[]
182	1	False	False	False	I almost died last year.	[]
182	2	False	False	True	That is a terrible thing to happen, 	[]
182	3	False	True	True	I'm sure...	[0.6695354, 0.5, 0.5, 0.5]
182	4	False	True	False	Yes I was very lucky.	[0.7356947, 0.5, 0.5, 0.5, 0.5]
182	5	False	True	True	I'm happy that you are still here as well! 	[0.80668, 0.5, 0.5, 0.5, 0.5, 0.5]
182	6	False	False	True	Think of the alternative :(	[]
183	0	True	True	False	I went swimming in the pool and some of my extensions came out in the water. 	[]
183	1	True	False	False	No one saw but me.	[]
183	2	False	False	False	Went for a dip at the pool late one night on vacation.	[]
183	3	False	False	True	Nice, 	[]
183	4	False	False	True	how was the water.	[]
183	5	False	False	False	It was a heated ppol so that was nice. 	[]
183	6	False	True	False	But when I jumped in some of may hair extension came out!	[0.7732826, 0.5, 0.5, 0.5, 0.5, 0.5, 0.5]
183	7	False	True	True	Thats funny. 	[0.85916984, 0.8517704, 0.85615015, 0.744584, 0.5, 0.5, 0.5, 0.5]
183	8	False	False	True	Did you get them all?	[]
183	9	False	False	False	Yes luckily no one else was there.	[]
184	0	True	True	False	I am terrified of ghosts.	[]
184	1	False	True	False	I am afraid of ghosts.	[0.87125003, 0.86792564]
184	2	False	False	True	Mw too. 	[]
184	3	False	True	True	I don't even llike when it's too dark inside or outside.	[0.80002975, 0.8631387, 0.5, 0.5]
184	4	False	True	False	I hope I never meet a ghost.	[0.8109367, 0.5, 0.5, 0.5, 0.5]
184	5	False	True	True	Maybe we are ghosts.	[0.8359668, 0.81338626, 0.786786, 0.8276063, 0.8042021, 0.8392722]
185	0	True	True	False	I am prepared for the hurricane.	[]
185	1	False	True	False	I always am prepared for hurricanes.	[0.86851376, 0.8452156]
185	2	False	False	True	I live in Texas, 	[]
185	3	False	True	True	We really dont have to worry about them here.	[0.83425105, 0.5, 0.5, 0.5]
185	4	False	False	False	I love Texas.	[]
185	5	False	False	True	Texas is a great place! 	[]
185	6	False	True	True	But I can understand the need to want to be prepared.	[0.8729679, 0.65598613, 0.5, 0.5, 0.5, 0.5, 0.5]
186	0	True	True	False	I got a huge bonus at work and was able to pay off my debt.	[]
186	1	False	False	False	So i got a huge bonus at work last week!	[]
186	2	False	False	True	How much?	[]
186	3	False	False	False	It was enough that I was able to pay off my car and a lot of bills.	[]
186	4	False	False	True	Cool. 	[]
186	5	False	False	True	What kind of car.	[]
186	6	False	True	False	It was a 84 Mustang.	[0.8063346, 0.7834671, 0.5, 0.5, 0.5, 0.5, 0.5]
187	0	True	False	False	Some left their garbage outside of the dumpster in my apartment complex. 	[]
187	1	True	False	False	Now at night there are a bunch of raccoons outside.	[]
187	2	False	False	False	My apartment is right near the dumpster for our commplex.	[]
187	3	False	False	True	That is terrible, 	[]
187	4	False	False	True	does it smell?	[]
187	5	False	False	False	no. 	[]
187	6	False	False	False	That's not the problem. 	[]
187	7	False	True	False	Sometimes people leave their trash on the outside and then there are a lot of raccoons out there at night.	[0.85995823, 0.7974318, 0.5, 0.5, 0.5, 0.5, 0.5, 0.5]
187	8	False	False	True	You should tell someone.	[]
187	9	False	False	False	I have for 5 years. 	[]
187	10	False	False	False	Everyone should just move awawy and I live here alone lol.	[]
188	0	True	True	False	I am hopeful I win the lottery.	[]
188	1	False	True	False	I hope I win the lottery this week.	[0.7089368, 0.84368336]
188	2	False	True	True	I think it's my turn to win the lottery	[0.8660074, 0.72548246, 0.5]
188	3	False	True	False	Maybe we can split it if we win.	[0.8483708, 0.8172134, 0.85367125, 0.8487661]
188	4	False	False	True	Sure, 	[]
188	5	False	True	True	That's sounds like a real plan. 	[0.8467807, 0.83540255, 0.83115596, 0.5, 0.5, 0.5]
188	6	False	False	True	lol	[]
189	0	True	True	False	My friend is annoying me.	[]
189	1	False	True	False	My friend is so annoying.	[0.6853325, 0.5]
189	2	False	False	True	what did he do?	[]
189	3	False	True	False	He just talks too much.	[0.79950386, 0.83501893, 0.5, 0.5]
189	4	False	False	True	yes, 	[]
189	5	False	True	True	i can see how it can bbe annoying	[0.7820654, 0.5, 0.5, 0.5, 0.5, 0.5]
190	0	True	True	False	I was joyful when my son was born.	[]
190	1	False	True	False	I was so happy when my son was born.	[0.7791587, 0.5]
190	2	False	False	True	awww. 	[]
190	3	False	False	True	don't tell anyone but my son is my favorite child. 	[]
190	4	False	False	True	I have two girls also.	[]
190	5	False	False	False	I won't tell anyone.	[]
190	6	False	False	True	How old is your son now?	[]
191	0	True	False	False	I can't wait for HAlloween. 	[]
191	1	True	False	False	It is my favorite holifay. 	[]
191	2	True	False	False	I love dressing up with the kids.	[]
191	3	False	True	False	Halloween can't get here quick enough.	[0.81441426, 0.5, 0.5, 0.5]
191	4	False	False	True	I love Halloween.	[]
191	5	False	False	False	It is my favorite. 	[]
191	6	False	False	False	I love dressing up with my kids and eating all of their candy.	[]
191	7	False	False	True	I love candy.	[]
192	0	True	True	False	I went to pick up my date and was very clam and collected.	[]
192	1	False	False	False	So I went to pick up Lucy last night for our date. 	[]
192	2	False	False	False	I was very polite and nice.	[]
192	3	False	False	True	Where did you meet her?	[]
192	4	False	False	False	We meet online on a dating site. 	[]
192	5	False	False	False	I was nervous but I did not let it show and took charge.	[]
192	6	False	False	True	Thats cool. 	[]
192	7	False	False	True	Will you see her again?	[]
192	8	False	False	False	We have plans to go out next week!	[]
193	0	True	True	False	I am proud I graduated college.	[]
193	1	False	True	False	I am so happy I graduated college.	[0.77445614, 0.5]
193	2	False	False	True	I bet! 	[]
193	3	False	True	True	It has to feel like a huge accomplishment.	[0.8102416, 0.8622736, 0.8561953, 0.771932]
193	4	False	True	False	Yes and I had a 4.0	[0.6796222, 0.5, 0.5, 0.5, 0.5]
193	5	False	False	True	I did not know you had a 4.0! 	[]
193	6	False	False	True	How do your parents feel about that.	[]
194	0	True	False	False	Got asked to my boss' office. 	[]
194	1	True	True	False	Thought I was getting bad news but turns out I was offered a promotion.	[]
194	2	False	False	False	Got asked to my boss' office. 	[]
194	3	False	True	False	Thought I was getting bad news but turns out I was offered a promotion.	[0.85250634, 0.78504705, 0.8590567, 0.7695381]
194	4	False	False	True	Nice. 	[]
194	5	False	False	True	Did you take it?	[]
194	6	False	False	False	I definitely did!	[]
194	7	False	False	True	Nice did you take it?	[]
195	0	True	True	False	I am confident I will pass the test.	[]
195	1	False	True	False	I have studied and am sure I will pass the test.	[0.8488174, 0.86252964]
195	2	False	False	True	Good luck! 	[]
195	3	False	False	True	Do your best. 	[]
195	4	False	True	True	you sound well prepapred.	[0.86250705, 0.62595856, 0.5, 0.5, 0.5]
195	5	False	False	False	I expect an A.	[]
195	6	False	False	True	I hope you get it!	[]
196	0	True	True	False	I think eventuallt the presidency is going to go in a more positive direction	[]
196	1	False	True	False	How about our president huh?	[0.87321424, 0.7973846]
196	2	False	False	True	I'm not actually in America so I don't share the same joy as you :p	[]
196	3	False	False	False	Lol. 	[]
196	4	False	False	False	There is no joy here. 	[]
196	5	False	True	False	But I think the only way to go is up now.	[0.62530714, 0.5, 0.5, 0.5, 0.5, 0.5]
196	6	False	False	True	That's always the positive side of hitting rock bottom right?	[]
197	0	True	True	False	I let my new neighbors borrow our lawnmower. 	[]
197	1	True	False	False	It came back broken.	[]
197	2	False	True	False	I let my new neighbors borrow our lawnmower. 	[0.7705942, 0.7957378, 0.5]
197	3	False	False	False	It came back broken.	[]
197	4	False	False	True	That's terrible. 	[]
197	5	False	True	True	Do you think they'll take care of it>	[0.64527196, 0.5, 0.5, 0.5, 0.5, 0.5]
197	6	False	False	False	No. 	[]
197	7	False	False	False	They went pretty quiet.	[]
197	8	False	True	True	Hope you don't end up in court.	[0.772521, 0.5, 0.5, 0.5, 0.5, 0.5, 0.5, 0.5, 0.5]
198	0	True	False	False	I ordered McDonalds yesterday and since my lazy daughter wouldn't get out of bed I ate her food. 	[]
198	1	True	False	False	I kind of fell bad about it.	[]
198	2	False	False	False	My daughter is being so lazy this summer.	[]
198	3	False	False	True	I think that's the usual for kids. 	[]
198	4	False	False	True	How old is she	[]
198	5	False	False	False	13. 	[]
198	6	False	True	False	I ate her dinner yesterday because she just refused to get up. 	[0.86278206, 0.8637831, 0.7159397, 0.5, 0.5, 0.5, 0.5]
198	7	False	True	False	I feel bad about it now	[0.83343744, 0.81400675, 0.5, 0.5, 0.5, 0.5, 0.5, 0.5]
198	8	False	False	True	That's kind of funny though. 	[]
198	9	False	False	True	How did she react?	[]
198	10	False	False	False	she went to bed lo	[]
199	0	True	True	False	I am ashamed I lied to the police.	[]
199	1	False	True	False	I lied to the police. 	[0.7590973, 0.85079044]
199	2	False	True	False	I am ashamed.	[0.84060663, 0.5, 0.5]
199	3	False	False	True	You should never lie to them. 	[]
199	4	False	False	True	What did you say?	[]
199	5	False	False	False	I said I did not know where my friend was.	[]
199	6	False	False	True	Did your friend do something bad? 	[]
199	7	False	False	True	Why were they looking for them	[]
200	0	True	True	False	I am ready to go to a amusement park with my son.	[]
