conv_id	clause_no	context?	emotion?	chatbot?	clause	prob
319	6	False	True	True	I know that feeling, 	[0.6105481, 0.5, 0.5, 0.5, 0.5, 0.5, 0.5]
319	7	False	True	True	good for you!	[0.8208305, 0.84109455, 0.7800382, 0.7733113, 0.78466934, 0.5, 0.5, 0.5]
319	8	False	True	False	You ever just get those moment where you shake it off and the confident feeling flows in.	[0.87018603, 0.8008764, 0.5, 0.5, 0.5, 0.5, 0.5, 0.5, 0.5]
319	9	False	False	True	Yes, 	[]
319	10	False	False	True	those are awesome feelings, 	[]
319	11	False	False	True	I crave that all the time	[]
320	0	True	False	False	I once broke a fax machine my parents spent a lot on. 	[]
320	1	True	True	False	I felt bad about it since it wasn't what i meant to do. 	[]
320	2	True	False	False	He ended up throwing the Fax machine around the room.	[]
320	3	False	True	False	So i felt bad once because i broke my parents fax machine. 	[0.8093814, 0.8406761, 0.869603, 0.5]
320	4	False	True	False	What made me feel bad even more he got angry.	[0.8261578, 0.5, 0.5, 0.5, 0.5]
320	5	False	False	True	well he did have a right to be angry (depending on how you broke it ofc)	[]
320	6	False	True	False	Yeah he did but i felt bad cause he threw the fax machine into the kitchen. 	[0.7656544, 0.5, 0.5, 0.5, 0.5, 0.5, 0.5]
320	7	False	False	False	This was a heavy machine by the way.	[]
320	8	False	False	True	oh darn thats just abit rude and unnecessary. 	[]
320	9	False	True	True	I hope everything is ok now 	[0.82390374, 0.5, 0.5, 0.5, 0.5, 0.5, 0.5, 0.5, 0.5, 0.5]
321	0	True	False	False	I met with an accident once. 	[]
321	1	True	True	False	Kindhearted passerby saved my life	[]
321	2	False	False	False	I have a met with an accident once. 	[]
321	3	False	True	False	one gentlemen saved my life	[0.85095274, 0.86404514, 0.85622084, 0.753019]
321	4	False	True	True	I am glad to hear that, 	[0.8462111, 0.5, 0.5, 0.5, 0.5]
321	5	False	True	True	did you repay him?	[0.87005, 0.80357003, 0.7669506, 0.5, 0.5, 0.5]
321	6	False	True	False	Yeah i did. 	[0.7672264, 0.5, 0.5, 0.5, 0.5, 0.5, 0.5]
321	7	False	False	False	I have visited him once i was up and running. 	[]
321	8	False	False	False	He was so chuffed see me breathing	[]
321	9	False	False	True	That is good to hear, 	[]
321	10	False	True	True	I am glad it worked out well instead of a disaster	[0.72736263, 0.8712496, 0.74756855, 0.5, 0.5, 0.5, 0.5, 0.5, 0.5, 0.5, 0.5]
321	11	False	True	False	God's grace it did worked out well. 	[0.80534464, 0.5, 0.5, 0.5, 0.5, 0.5, 0.5, 0.5, 0.5, 0.5, 0.5, 0.5]
321	12	False	False	False	We became buddies over the time	[]
322	0	True	True	False	I was angry when my brother ruined the result of a football game. 	[]
322	1	True	False	False	I recorded it to watch later	[]
322	2	False	True	False	I was angry when my brother ruined the result of a football game. 	[0.83359885, 0.76913786, 0.7129579]
322	3	False	False	False	I recorded it to watch later	[]
322	4	False	True	True	sibling fights worth living for.. 	[0.8692841, 0.7791498, 0.84650475, 0.5, 0.5]
322	5	False	True	True	I wish  i had one.	[0.7829488, 0.69706255, 0.8436449, 0.8174762, 0.8444038, 0.83861375]
322	6	False	False	False	I am glad I do, 	[]
322	7	False	True	False	I just wish they could shutup sometimes haha	[0.7716492, 0.5, 0.5, 0.5, 0.5, 0.5, 0.5, 0.5]
322	8	False	True	True	you would know better hehe!!	[0.8649406, 0.64288914, 0.5, 0.5, 0.5, 0.5, 0.5, 0.5, 0.5]
323	0	True	True	False	I am excited tomorrow is my birthday	[]
323	1	False	True	False	I am so excited. 	[0.80637765, 0.5]
323	2	False	False	False	Tomorrow is my birthday	[]
323	3	False	True	True	Well happy early birthday! 	[0.8476435, 0.7823564, 0.84764767, 0.8396936]
323	4	False	False	True	I hope you have a great day!	[]
323	5	False	False	False	Thanks. 	[]
323	6	False	False	False	I can't wait for tomorrow for the party and the presents	[]
323	7	False	False	True	I bet, 	[]
323	8	False	False	True	I hope you get everything you want!	[]
324	0	True	True	False	I was lonely as a teenager , I had no girlfriend and few friends. 	[]
324	1	True	True	False	I was sad often	[]
324	2	False	True	False	I was lonely as a teenager, 	[0.5656897, 0.5, 0.5]
324	3	False	True	False	I had no girlfriend and few friends. 	[0.84701234, 0.86424553, 0.7195639, 0.5]
324	4	False	True	False	I was sad often	[0.85076755, 0.8372477, 0.8578381, 0.8042731, 0.5]
324	5	False	False	True	Sorry to hear that. 	[]
324	6	False	False	True	Do you have more firends now?	[]
324	7	False	False	False	I do luckily, 	[]
324	8	False	False	False	and a great girlfriend, 	[]
324	9	False	False	False	so things work out in the end	[]
324	10	False	False	True	Great.	[]
325	0	True	True	False	I am so proud about myself. 	[]
325	1	True	True	False	I just got promoted.	[]
325	2	False	True	False	I am so proud about myself. 	[0.8434708, 0.8565989, 0.79195607]
325	3	False	True	False	I just got promoted at my firm.	[0.8524283, 0.8555336, 0.6987879, 0.5]
325	4	False	True	True	Good job! 	[0.7610618, 0.5, 0.5, 0.5, 0.5]
325	5	False	True	True	I am sure that took a lot of hard work!	[0.8264908, 0.8311155, 0.84300834, 0.7730133, 0.5, 0.5]
325	6	False	False	False	You have no idea. 	[]
325	7	False	True	False	I have been waiting 3 years for that promotion.	[0.8123111, 0.842114, 0.8488041, 0.83628035, 0.8279169, 0.84086794, 0.84241104, 0.6677282]
325	8	False	True	True	I am sure that was stressful that whole time	[0.73847395, 0.83826905, 0.83633393, 0.82274544, 0.8483805, 0.82798016, 0.8565415, 0.84470284, 0.8454217]
326	0	True	True	False	playing my gameboy makes me nostalgic. 	[]
326	1	True	False	False	i love pokemon emerald the most	[]
326	2	False	True	False	playing my gameboy makes me nostalgic. 	[0.8347784, 0.8211962, 0.5]
326	3	False	False	False	i love pokemon emerald the most	[]
326	4	False	False	True	Me to. 	[]
326	5	False	True	True	I also play gameboy from time to time	[0.76861626, 0.5, 0.5, 0.5, 0.5, 0.5]
326	6	False	True	False	I still have my one from when I was young, 	[0.76171947, 0.5, 0.5, 0.5, 0.5, 0.5, 0.5]
326	7	False	False	False	it is in good shape	[]
326	8	False	True	True	I do not have mine.I bought one on EBAY and also 12 games just to remember the past	[0.8443733, 0.8606327, 0.7123817, 0.5, 0.5, 0.5, 0.5, 0.5, 0.5]
327	0	True	True	False	Someone rear ended me a few months ago. 	[]
327	1	True	False	False	I was very upset because I had places to be	[]
327	2	False	True	False	Someone rear ended me a few months ago. 	[0.8661628, 0.7511619, 0.5]
327	3	False	True	False	I was very upset because I had places to be	[0.7639982, 0.5, 0.5, 0.5]
327	4	False	True	True	That is so aggravating! 	[0.87358755, 0.7911492, 0.5, 0.5, 0.5]
327	5	False	False	True	I've been in the exact same situation. 	[]
327	6	False	False	True	I hope you weren't hurt.	[]
327	7	False	True	False	I was okay, 	[0.8559888, 0.8389927, 0.8573916, 0.5, 0.5, 0.5, 0.5, 0.5]
327	8	False	False	False	but my car got a bit messed up	[]
327	9	False	True	True	Good to hear you were all right. 	[0.86358196, 0.8498985, 0.85918224, 0.5, 0.5, 0.5, 0.5, 0.5, 0.5, 0.5]
327	10	False	True	True	Hopefully insurance covered your car -- though I know nothing makes up for the time spent dealing with the situation!	[0.80597967, 0.5, 0.5, 0.5, 0.5, 0.5, 0.5, 0.5, 0.5, 0.5, 0.5]
328	0	True	True	False	I was terrifified when my dad scared me as a kid. 	[]
328	1	True	False	False	I have to admit he was good at it	[]
328	2	False	True	False	I was terrifified when my dad scared me as a kid. 	[0.79536664, 0.5, 0.5]
328	3	False	False	False	I have to admit he was good at it	[]
328	4	False	False	True	I believe this kind of a rude attitude by parents leave an impression on the kid's growth	[]
328	5	False	False	False	I turned out okay, 	[]
328	6	False	False	False	but for some people it certainly might	[]
328	7	False	False	True	True, 	[]
328	8	False	True	True	I have a close friend who's quite young now and he seems to have scary thoughts about his childhood days	[0.7224634, 0.5, 0.5, 0.5, 0.5, 0.5, 0.5, 0.5, 0.5]
329	0	True	True	False	Last winters , I went uphill and took a 2 hour Skiing classes which really helped to enjoy Skiing there after	[]
329	1	False	False	False	I was really fascinated by Skiing and though about taking lessons to make it easy for me.	[]
329	2	False	False	True	I wish I could afford lessons or to even try, 	[]
329	3	False	False	True	I bet it is really fun!	[]
329	4	False	False	False	Yeah it's an amazing experience altogether. 	[]
329	5	False	True	False	I really enjoy the sport.	[0.61456823, 0.5, 0.5, 0.5, 0.5, 0.5]
329	6	False	False	True	I do like to watch it in the olympics or sure though!	[]
329	7	False	False	False	During last winter Olympics, 	[]
329	8	False	True	False	my country did really well in the sport ! 	[0.81509054, 0.84609216, 0.5, 0.5, 0.5, 0.5, 0.5, 0.5, 0.5]
330	0	True	False	False	I hope the nintendo switch get madden on it. 	[]
330	1	True	False	False	I love portable football games	[]
330	2	False	True	False	I hope the nintendo switch get madden on it. 	[0.78015524, 0.6280127, 0.82431656]
330	3	False	False	False	I love portable football games	[]
330	4	False	False	True	I like them too. 	[]
330	5	False	False	True	I like to play football games while I'm eating Chik-Fil-A, 	[]
330	6	False	False	True	but I always want to go on Sundays when they're closed.	[]
330	7	False	True	False	I feel that one deep in my core, 	[0.7456444, 0.5, 0.5, 0.5, 0.5, 0.5, 0.5, 0.5]
330	8	False	True	False	I want it ten times more then	[0.77728593, 0.5, 0.5, 0.5, 0.5, 0.5, 0.5, 0.5, 0.5]
330	9	False	False	True	I never think about it during the week, 	[]
330	10	False	False	True	the craving always hits me on Sunday. 	[]
330	11	False	False	True	It's very disheartening when you pull up and the place is completely empty.	[]
331	0	True	True	False	I felt joyful when my wife and I decided to go to the lake today. 	[]
331	1	True	True	False	This situation has made me feel really happy because I love swimming. 	[]
331	2	False	True	False	I'm so happy about going to the lake with my wife, 	[0.8515475, 0.823741, 0.7979739]
331	3	False	True	False	it makes me burst with joy!	[0.83235604, 0.8588464, 0.5, 0.5]
331	4	False	True	True	That sounds like fun! 	[0.76236165, 0.5, 0.5, 0.5, 0.5]
331	5	False	False	True	What are you planning to do at the lake.	[]
331	6	False	False	False	I'm planning to relax, 	[]
331	7	False	False	False	maybe even swim, 	[]
331	8	False	False	False	sit near the water. 	[]
331	9	False	True	False	I love swimming!	[0.7960462, 0.8627135, 0.5, 0.5, 0.5, 0.5, 0.5, 0.5, 0.5, 0.5]
331	10	False	True	True	It will be a great escape from regular life, 	[0.71663475, 0.754407, 0.8339293, 0.8253405, 0.8044512, 0.7866024, 0.8370498, 0.840473, 0.6820284, 0.5, 0.5]
331	11	False	False	True	right? 	[]
331	12	False	True	True	How often do you get to go?	[0.811664, 0.80763906, 0.83803415, 0.76283944, 0.5, 0.5, 0.5, 0.5, 0.5, 0.5, 0.5, 0.5, 0.5]
331	13	False	True	False	I haven't been to the lake for like a year so it's going to be a lot of fun. 	[0.84392697, 0.84930575, 0.8085678, 0.7723124, 0.5, 0.5, 0.5, 0.5, 0.5, 0.5, 0.5, 0.5, 0.5, 0.5]
331	14	False	False	False	It's definitely going to be an escape from the daily life.	[]
332	0	True	False	False	My husband cut his hand while working in the yard. 	[]
332	1	True	False	False	He came inside and needed a bandage. 	[]
332	2	True	True	False	I was able to care for his wound with alcohol , gauze and a bandage. 	[]
332	3	True	False	False	I joked with him and made him smile.	[]
332	4	False	False	False	My husband mowed the lawn today and repaired our back fence.	[]
332	5	False	False	True	Oh that's nice, 	[]
332	6	False	False	True	you must have a hard-working husband.	[]
332	7	False	False	False	Yes! 	[]
332	8	False	False	False	Unfortunately, 	[]
332	9	False	True	False	while working on the fence, 	[0.8188017, 0.8442337, 0.8182583, 0.5, 0.5, 0.5, 0.5, 0.5, 0.5, 0.5]
332	10	False	False	False	he grabbed a board with a rough edge and cut his hand.	[]
332	11	False	False	True	That sounds horrible. 	[]
332	12	False	False	True	Was it serious?	[]
332	13	False	False	False	Not too bad, 	[]
332	14	False	False	False	just needed a band-aid.	[]
333	0	True	False	False	When i was young i loved Jurassic Park. 	[]
333	1	True	True	False	Family went down to Florida to the universal park. 	[]
333	2	True	True	False	I was so hyper and happy to get on that ride for the movie.	[]
333	3	False	False	False	So favorite movie is Jurassic park and they had that ride at Universal. 	[]
333	4	False	False	False	I loved that ride so much i was so hyper waiting in line.	[]
333	5	False	True	True	That sounds like fun! 	[0.8483667, 0.8251641, 0.5, 0.5, 0.5, 0.5]
333	6	False	False	True	Was it your first time at Universal? 	[]
333	7	False	True	False	Yes! 	[0.835371, 0.8617322, 0.5, 0.5, 0.5, 0.5, 0.5, 0.5]
333	8	False	True	False	it was indeed my first time there even. 	[0.8167205, 0.5, 0.5, 0.5, 0.5, 0.5, 0.5, 0.5, 0.5]
333	9	False	True	False	So that was even more exciting.	[0.6958778, 0.5, 0.5, 0.5, 0.5, 0.5, 0.5, 0.5, 0.5, 0.5]
333	10	False	False	True	I can imagine! 	[]
333	11	False	True	True	Were there any other memorable aspects of the visit? 	[0.8573944, 0.8253265, 0.5, 0.5, 0.5, 0.5, 0.5, 0.5, 0.5, 0.5, 0.5, 0.5]
334	0	True	False	False	I have tried really hard to make my new business work. 	[]
334	1	True	True	False	It's been a very slow start.	[]
334	2	False	False	False	I am working very hard at getting new business and I want people to trust me.	[]
334	3	False	False	True	Those are both admirable ideas. 	[]
334	4	False	False	True	How are you trying to improve trust?	[]
334	5	False	False	False	I talk about my business to everyone at meetings and why it's important to use a travel agent and not go with the cheap guys online.	[]
334	6	False	False	True	Travel agents make complicated travel so much easier than using online sites. 	[]
334	7	False	False	False	We do! 	[]
334	8	False	False	False	It's very time consuming looking on line. 	[]
334	9	False	False	False	Even with the cruise lines I'm going to get better deals and better cabin space for a client	[]
334	10	False	False	True	That's awesome. 	[]
334	11	False	False	True	Best of luck to you with your business! 	[]
334	12	False	False	False	Thank you very much!	[]
335	0	True	False	False	On my birthday , no one showed up to the celebration. 	[]
335	1	True	True	False	I had dinner by myself in my apartment.	[]
335	2	False	True	False	No one showed up to my birthday part so I ate by myself at home. 	[0.85190266, 0.7721366, 0.5]
335	3	False	False	True	I'm sorry to hear that! 	[]
335	4	False	False	True	Happy Birthday! 	[]
335	5	False	False	True	Hope you didn't eat the entire cake LOL!	[]
335	6	False	False	False	I wish! 	[]
335	7	False	False	False	I did enjoy a good dinner, 	[]
335	8	False	False	False	but it would have been nice if others were around to celebrate.	[]
335	9	False	True	True	I decided not to celebrate birthdays anymore now that I'm old!	[0.80008066, 0.5, 0.5, 0.5, 0.5, 0.5, 0.5, 0.5, 0.5, 0.5]
335	10	False	False	False	Well, 	[]
335	11	False	False	False	I like to think of it as an excuse to meet friends and family. 	[]
335	12	False	True	False	Too bad I was away from family that day!	[0.8362543, 0.5, 0.5, 0.5, 0.5, 0.5, 0.5, 0.5, 0.5, 0.5, 0.5, 0.5, 0.5]
335	13	False	False	True	Maybe next year will be better! 	[]
336	0	True	True	False	I was out hiking , and came very close to stepping on a rattlesnake. 	[]
336	1	True	True	False	There was not an easy way to get around it , so we had to backtrack and cut through some heavy brush.	[]
336	2	False	False	False	A few years ago, 	[]
336	3	False	False	False	I was out hiking, 	[]
336	4	False	True	False	and almost stepped on a rattlesnake. 	[0.73228914, 0.5, 0.5, 0.5, 0.5]
336	5	False	False	False	Thank goodness it alerted!	[]
336	6	False	False	True	Oh my goodness! 	[]
336	7	False	True	True	That must have been frightening. 	[0.7548893, 0.8424431, 0.84557366, 0.842806, 0.85036826, 0.8348249, 0.80919397, 0.84525424]
336	8	False	True	True	What happened after it alerted?	[0.8582725, 0.81724286, 0.8198551, 0.8406377, 0.83916056, 0.851836, 0.8397095, 0.74359375, 0.8571813]
336	9	False	True	False	It took me a minute to figure out what I was hearing, 	[0.86081403, 0.8220782, 0.5, 0.5, 0.5, 0.5, 0.5, 0.5, 0.5, 0.5]
336	10	False	False	False	and then I back up VERY quickly!!	[]
336	11	False	False	True	Where did the snake go?	[]
336	12	False	False	False	It stayed put. 	[]
336	13	False	True	False	My friend and I had to backtrack, 	[0.30344203, 0.5, 0.5, 0.5, 0.5, 0.5, 0.5, 0.5, 0.5, 0.5, 0.5, 0.5, 0.5, 0.5]
336	14	False	False	False	and cut through some heavy brush to get around it, 	[]
336	15	False	True	False	because the trail was too narrow to walk past it on. 	[0.59205693, 0.5, 0.5, 0.5, 0.5, 0.5, 0.5, 0.5, 0.5, 0.5, 0.5, 0.5, 0.5, 0.5, 0.5, 0.5]
337	0	True	True	False	I recently wore a bikini to the beach after losing 20 lbs. 	[]
337	1	True	True	False	I felt amazing!	[]
337	2	False	False	False	My last trip to the beach was amazing! 	[]
337	3	False	True	False	I felt confident enough to wear a bikini!	[0.6114764, 0.5, 0.5, 0.5]
337	4	False	True	True	That is awesome! 	[0.76795715, 0.8489712, 0.82206714, 0.8494901, 0.5]
337	5	False	False	True	I bet you had a great time!	[]
337	6	False	True	False	I did! 	[0.83376217, 0.7776402, 0.60977066, 0.84311247, 0.82972026, 0.7912603, 0.80872595]
337	7	False	True	False	I was celebrating having lost 20lbs! 	[0.8483034, 0.5, 0.5, 0.5, 0.5, 0.5, 0.5, 0.5]
337	8	False	False	False	At first I was nervous, 	[]
337	9	False	False	False	but then it was fun.	[]
337	10	False	False	True	Weight loss can be so liberating! 	[]
337	11	False	True	True	I'm glad you were able to enjoy yourself.	[0.7489495, 0.5, 0.5, 0.5, 0.5, 0.5, 0.5, 0.5, 0.5, 0.5, 0.5, 0.5]
338	0	True	True	False	My grandmother is getting out of the hospital	[]
338	1	False	True	False	I am so happy. 	[0.6873819, 0.5]
338	2	False	True	False	My grandmother is getting out of the hospital.	[0.77317154, 0.5, 0.5]
338	3	False	False	True	That's awesome. 	[]
338	4	False	False	True	Is she better?	[]
338	5	False	False	False	Yes, 	[]
338	6	False	False	False	she is. 	[]
338	7	False	False	False	She having issues with her heart. 	[]
338	8	False	False	False	She needed a chirurgical operation.	[]
338	9	False	False	True	That's scary! 	[]
338	10	False	False	True	How old is she?	[]
339	0	True	True	False	I hope the immigrants children get reunited with their families	[]
339	1	False	True	False	I hope the immigrants children get reunited with their families	[0.7504901, 0.5]
339	2	False	False	True	Same. 	[]
339	3	False	False	True	It is just a devasting thing that is happening. 	[]
339	4	False	False	False	Yes, 	[]
339	5	False	True	False	it is.This problem in the border is very complex and emotive 	[0.71887624, 0.8362803, 0.81834346, 0.82883996, 0.84657174, 0.8231841]
339	6	False	False	True	That is true. 	[]
339	7	False	False	True	But this is basic humanity you know. 	[]
339	8	False	True	True	Surely there is another way 	[0.8280148, 0.862216, 0.8524778, 0.5, 0.5, 0.5, 0.5, 0.5, 0.5]
340	0	True	True	False	I was very sure of myself when applying and getting into physical therapy school.	[]
340	1	False	False	False	I was a student in undergraduate school when this happened.	[]
340	2	False	False	True	When what happened?	[]
340	3	False	False	False	When I was applying to physical therapy school.	[]
340	4	False	False	True	What was the issue that plagued you?	[]
340	5	False	False	False	There was no issue that plagued me.	[]
341	0	True	True	False	I am so jealous of my co-worker.He got the promotion I had my eye on it.	[]
341	1	False	True	False	My co-worker got the promotion I had my eye on it.I am so mad and jealous.	[0.8146331, 0.8506039]
341	2	False	False	True	Damn, 	[]
341	3	False	False	True	that sucks. 	[]
341	4	False	False	True	What field do you work in?	[]
341	5	False	False	False	I work in Banking and insurance. 	[]
341	6	False	False	False	I have more experience than him.	[]
341	7	False	True	True	Why did he get the promotion over you?	[0.7683952, 0.5, 0.5, 0.5, 0.5, 0.5, 0.5, 0.5]
342	0	True	True	False	When I was gifted my laptop for christmas	[]
342	1	False	False	False	This past chrstmas, 	[]
342	2	False	False	False	I was gifted my HP laptop, 	[]
342	3	False	False	False	and I have been consistently using it ever since! 	[]
342	4	False	False	False	It really was a great gift.	[]
342	5	False	False	True	That's such a nice gift! 	[]
342	6	False	False	True	What are your main uses of it? 	[]
342	7	False	False	False	Mainly Youtube, 	[]
342	8	False	False	False	I do some freelance work on it occasionally, 	[]
342	9	False	False	False	and Reddit. 	[]
342	10	False	False	False	Lots of Reddit. 	[]
342	11	False	False	True	I've heard great things about Reddit but have never actually signed up myself!	[]
343	0	True	False	False	Once my little cousin got into my room and pour coke onto my keyboard. 	[]
343	1	True	False	False	He didn't mean to do it but the coke ended up spilling off the desk into my computer. 	[]
343	2	True	True	False	Fried the computer and i was just so mad!	[]
343	3	False	False	False	So i had this annoying little cousin. 	[]
343	4	False	True	False	He went into my room when i wasn't there and got my computer fried because he spilled coke on the desk and into the computer.	[0.8234606, 0.5, 0.5, 0.5, 0.5]
343	5	False	False	True	That's not good at all. 	[]
343	6	False	False	True	Did you lose any important data?	[]
343	7	False	False	False	I lost a lot of my data i used school at the time. 	[]
343	8	False	True	False	I was really mad at him.	[0.8364203, 0.83946925, 0.5, 0.5, 0.5, 0.5, 0.5, 0.5, 0.5]
343	9	False	False	True	I would be too! 	[]
343	10	False	False	True	That sounds like a real inconvenience. 	[]
344	0	True	True	False	I had an interview the other day for a part-time-job and am hoping I get it! 	[]
344	1	False	True	False	I had an interview last week for a part-time-job and I hope I get it it. 	[0.7431816, 0.5]
344	2	False	True	False	I have been an unemployed student for 6 months and the work would help!	[0.81916445, 0.5, 0.5]
344	3	False	True	True	I will send all the good vibes! 	[0.76185757, 0.5, 0.5, 0.5]
344	4	False	False	True	Is it in a field you could see yourself making a career of?	[]
344	5	False	False	False	No, 	[]
344	6	False	False	False	it is unrelated to my career field and temporary work. 	[]
344	7	False	False	False	Thanks for the good vibes. 	[]
344	8	False	False	False	Waiting to hear back from an interview is nerve racking! 	[]
344	9	False	False	True	Always, 	[]
344	10	False	False	True	it is. 	[]
344	11	False	False	True	And it sounds empty to say it will all work out for the best....but it will! 	[]
344	12	False	True	True	In the meantime, 	[0.8459666, 0.7116169, 0.5, 0.5, 0.5, 0.5, 0.5, 0.5, 0.5, 0.5, 0.5, 0.5, 0.5]
344	13	False	False	True	are you applying/interviewing for other positions?	[]
345	0	True	False	False	I am so annoyed that France is in the world cup final.	[]
345	1	False	True	False	I am so annoyed that France is in the world cup final. 	[0.75203156, 0.5]
345	2	False	True	False	I do not like their style of play	[0.85228765, 0.82392883, 0.5]
345	3	False	True	True	What is it about their style of play that you're not a fan of?	[0.87273395, 0.8561751, 0.7610667, 0.5]
345	4	False	True	False	They are to defensive.Their games are so boring.	[0.86998844, 0.561497, 0.5, 0.5, 0.5]
345	5	False	False	True	I see where you're coming from. 	[]
346	0	True	False	False	I am so surprised Roger Federer lost his match on Wimbledon 	[]
346	1	False	False	False	I am so surprised Roger Federer lost yesterday at Wimbledon. 	[]
346	2	False	True	False	he is the GOAT of tennis.	[0.8265514, 0.80182964, 0.5]
346	3	False	False	True	I'm not too familiar with Tennis, 	[]
346	4	False	True	True	Is he known to be a winner? 	[0.7969295, 0.7411175, 0.5, 0.5, 0.5]
346	5	False	True	False	He is the best player ever.He won the mos grand slams titles.	[0.780602, 0.5, 0.5, 0.5, 0.5, 0.5]
346	6	False	True	True	Wow that's neat! 	[0.866893, 0.7412496, 0.5, 0.5, 0.5, 0.5, 0.5]
346	7	False	False	True	Crazy to hear he lost then as you said.	[]
347	0	True	True	False	Shortly after I got married , my wife and I decided that we wanted to have kids. 	[]
347	1	True	True	False	When we found out she was pregnant , we couldn't wait to find out if we were having a boy or a girl.	[]
347	2	False	False	False	When my wife and I got married, 	[]
347	3	False	True	False	we knew we wanted to have kids. 	[0.7733858, 0.5, 0.5, 0.5]
347	4	False	False	False	 When we found out that we were expecting, 	[]
347	5	False	True	False	the only thing on our mind for the longest time was if we were having a boy or a girl.	[0.7967267, 0.5, 0.5, 0.5, 0.5, 0.5]
347	6	False	False	True	What exciting news! 	[]
347	7	False	True	True	Did you find out ahead of time what the gender of the baby was?	[0.8419292, 0.8224057, 0.6801198, 0.8263493, 0.84788364, 0.79465544, 0.5, 0.5]
347	8	False	False	False	We did! 	[]
347	9	False	False	False	We were living in Japan at the time, 	[]
347	10	False	True	False	and we were paying this clinic 2000 yen a week so we could keep getting ultrasounds of the baby.	[0.6787309, 0.5, 0.5, 0.5, 0.5, 0.5, 0.5, 0.5, 0.5, 0.5, 0.5]
347	11	False	False	True	What is 2000 yen equal to in U.S. 	[]
347	12	False	True	True	currency?	[0.8166403, 0.8417057, 0.7279873, 0.5, 0.5, 0.5, 0.5, 0.5, 0.5, 0.5, 0.5, 0.5, 0.5]
347	13	False	False	False	At the time, 	[]
347	14	False	False	False	the exchange rate was about 110 yen to the dollar, 	[]
347	15	False	False	False	so it was pretty affordable, 	[]
347	16	False	False	False	and worth it to keep going back.	[]
347	17	False	False	True	It sure sounds like it. 	[]
347	18	False	True	True	I think healthcare in Japan is much more affordable that here in America, 	[0.6611696, 0.5, 0.5, 0.5, 0.5, 0.5, 0.5, 0.5, 0.5, 0.5, 0.5, 0.5, 0.5, 0.5, 0.5, 0.5, 0.5, 0.5, 0.5]
347	19	False	True	True	do you agree?	[0.79936284, 0.84390026, 0.5, 0.5, 0.5, 0.5, 0.5, 0.5, 0.5, 0.5, 0.5, 0.5, 0.5, 0.5, 0.5, 0.5, 0.5, 0.5, 0.5, 0.5]
347	20	False	False	False	I wouldn't be able to tell you, 	[]
