conv_id	clause_no	context?	emotion?	chatbot?	clause	prob
0	0	True	True	False	I remember going to the fireworks with my best friend. 	[]
0	1	True	True	False	There was a lot of people , but it only felt like us in the world.	[]
0	2	False	True	False	I remember going to see the fireworks with my best friend. 	[0.870618, 0.82565933, 0.8325027]
0	3	False	True	False	It was the first time we ever spent time alone together. 	[0.8000771, 0.77942777, 0.6999794, 0.8388547]
0	4	False	False	False	Although there was a lot of people, 	[]
0	5	False	False	False	we felt like the only people in the world.	[]
0	6	False	True	True	Was this a friend you were in love with, 	[0.8679983, 0.86544, 0.83283824, 0.84619206, 0.5, 0.5, 0.5]
0	7	False	False	True	or just a best friend?	[]
0	8	False	False	False	This was a best friend. 	[]
0	9	False	True	False	I miss her.	[0.86922663, 0.6873251, 0.5, 0.5, 0.5, 0.5, 0.5, 0.5, 0.5, 0.5]
0	10	False	True	True	Where has she gone?	[0.81341285, 0.84063065, 0.8455901, 0.7854977, 0.5, 0.5, 0.5, 0.5, 0.5, 0.5, 0.5]
0	11	False	True	False	We no longer talk.	[0.6962792, 0.5, 0.5, 0.5, 0.5, 0.5, 0.5, 0.5, 0.5, 0.5, 0.5, 0.5]
0	12	False	True	True	Oh was this something that happened because of an argument?	[0.8465925, 0.8685983, 0.5, 0.5, 0.5, 0.5, 0.5, 0.5, 0.5, 0.5, 0.5, 0.5, 0.5]
1	0	True	True	False	 i used to scare for darkness	[]
1	1	False	True	False	 it feels like hitting to blank wall when i see the darkness	[0.83847433, 0.79628426]
1	2	False	False	True	Oh ya? 	[]
1	3	False	True	True	I don't really see how	[0.84214413, 0.74893683, 0.5, 0.5]
1	4	False	False	False	dont you feel so.. 	[]
1	5	False	False	False	its a wonder 	[]
1	6	False	False	True	I do actually hit blank walls a lot of times but i get by	[]
1	7	False	False	False	 i virtually thought so.. 	[]
1	8	False	False	False	and i used to get sweatings	[]
1	9	False	True	True	Wait what are sweatings	[0.8395946, 0.8670306, 0.64585567, 0.5, 0.5, 0.5, 0.5, 0.5, 0.5, 0.5]
2	0	True	True	False	I showed a guy how to run a good bead in welding class and he caught on quick.	[]
2	1	False	False	False	Hi how are you doing today	[]
2	2	False	True	True	doing good.. 	[0.7924585, 0.5, 0.5]
2	3	False	False	True	how about you	[]
2	4	False	False	False	Im good, 	[]
2	5	False	False	False	trying to understand how someone can feel like hitting a blank wall when they see the darkness	[]
2	6	False	False	True	it's quite strange that you didnt imagine it	[]
2	7	False	False	False	i dont imagine feeling a lot, 	[]
2	8	False	False	False	maybe your on to something	[]
3	0	True	True	False	I have always been loyal to my wife.	[]
3	1	False	True	False	I have never cheated on my wife.	[0.7743759, 0.5]
3	2	False	False	True	And thats something you should never do, 	[]
3	3	False	True	True	good on you. 	[0.7729356, 0.5, 0.5, 0.5]
3	4	False	True	False	Yea it hasn't been easy but I am proud I haven't	[0.664093, 0.5, 0.5, 0.5, 0.5]
3	5	False	False	True	What do you mean it hasn't been easy? 	[]
3	6	False	False	True	How close have you come to cheating? 	[]
4	0	True	True	False	A recent job interview that I had made me feel very anxious because I felt like I didn't come prepared.	[]
4	1	False	False	False	Job interviews always make me sweat bullets, 	[]
4	2	False	False	False	makes me uncomfortable in general to be looked at under a microscope like that. 	[]
4	3	False	False	True	Don't be nervous. 	[]
4	4	False	False	True	Just be prepared.	[]
4	5	False	False	False	I feel like getting prepared and then having a curve ball thrown at you throws you off. 	[]
4	6	False	False	True	Yes but if you stay calm it will be ok.	[]
4	7	False	False	False	It's hard to stay clam. 	[]
4	8	False	False	False	How do you do it? 	[]
5	0	True	False	False	I am very happy to have been first over 300 students during this years at my enginering school	[]
5	1	False	True	False	Hi, 	[0.8689789, 0.81135553]
5	2	False	True	False	this year, 	[0.64545393, 0.5, 0.5]
5	3	False	False	False	I was the first over 300 students at my enginering school	[]
5	4	False	True	True	Sounds great! 	[0.86219966, 0.68139684, 0.5, 0.5, 0.5]
5	5	False	False	True	So what's your major?	[]
5	6	False	False	False	It is computer science. 	[]
5	7	False	False	False	I am very happy of this achievement and my family is very proud.	[]
5	8	False	True	True	Well pleased. 	[0.87530315, 0.87130696, 0.7840522, 0.77651805, 0.5, 0.5, 0.5, 0.5, 0.5]
5	9	False	False	True	You should be having brains,man!That's a tough course,i hear.	[]
6	0	True	True	False	I once lost my job and got mad.	[]
6	1	False	True	False	I lost my job last year and got really angry.	[0.80216265, 0.8735512]
6	2	False	False	True	I am sorry to hear that. 	[]
6	3	False	False	True	Did it happen out of the blue?	[]
6	4	False	False	False	Yes, 	[]
6	5	False	False	False	it was a complete surprise.	[]
6	6	False	False	True	I am sorry to hear that. 	[]
6	7	False	False	True	I hope it turned out to be a blessing in decise.	[]
7	0	True	True	False	One year during christmas , i did not get a single gift. 	[]
7	1	True	True	False	It was a rough day for me.	[]
7	2	False	False	False	During christmas a few years ago, 	[]
7	3	False	False	False	I did not get any presents.	[]
7	4	False	False	True	Wow, 	[]
7	5	False	False	True	that must be terrible, 	[]
7	6	False	False	True	I cannot imagine, 	[]
7	7	False	False	True	I lvoe christmas	[]
7	8	False	True	False	Since that day christmas has not been a good time for me. 	[0.8309076, 0.84490633, 0.44011885, 0.5, 0.5, 0.5, 0.5, 0.5, 0.5]
7	9	False	True	False	As I have no family, 	[0.8669106, 0.8589837, 0.5682045, 0.5, 0.5, 0.5, 0.5, 0.5, 0.5, 0.5]
7	10	False	False	False	christmas is always the worst.	[]
7	11	False	False	True	Wow, 	[]
7	12	False	False	True	I am sorry to hear that, 	[]
7	13	False	False	True	I wish I could make it a better holiday for you!	[]
7	14	False	True	False	Some days are just days that you never forget. 	[0.8075136, 0.5, 0.5, 0.5, 0.5, 0.5, 0.5, 0.5, 0.5, 0.5, 0.5, 0.5, 0.5, 0.5, 0.5]
7	15	False	False	False	I wish you could as well.	[]
8	0	True	True	False	I was at work , and my coworker was called into my bosses office. 	[]
8	1	True	False	False	Then they were allowed to work remotely every monday. 	[]
8	2	True	True	False	this made me jealous because I enjoy working from home	[]
8	3	False	True	False	My coworker is allowed to work remotely, 	[0.8048511, 0.8131825, 0.5, 0.5]
8	4	False	False	False	but I am not...	[]
8	5	False	False	True	I work remotely, 	[]
8	6	False	False	True	I wish that you could do something like that as well.	[]
8	7	False	False	False	I do too, 	[]
8	8	False	False	False	it is unfortnuate because, 	[]
8	9	False	False	False	unbiased, 	[]
8	10	False	False	False	I am our best performer, 	[]
8	11	False	False	False	so it is curious	[]
8	12	False	False	True	Sometimes in life, 	[]
8	13	False	False	True	it is not about performance. 	[]
8	14	False	True	True	Some people just get a shiner spoon.	[0.775324, 0.5, 0.5, 0.5, 0.5, 0.5, 0.5, 0.5, 0.5, 0.5, 0.5, 0.5, 0.5, 0.5, 0.5]
9	0	True	False	False	I was home alone. 	[]
9	1	True	True	False	I heard a loud noise come from the kitchen. 	[]
9	2	False	True	False	The other night I was alone and heard a nose coming from the kitchen... 	[0.84146446, 0.8523446, 0.5]
9	3	False	True	False	it was creepy. 	[0.7818449, 0.5, 0.5, 0.5]
10	0	True	False	False	I went to a park and I set on a bench. 	[]
10	1	True	False	False	I didn't notice that my wallet felt. 	[]
10	2	True	False	False	A man came to me from behind giving me back my wallet.	[]
10	3	False	False	False	Hi, 	[]
10	4	False	True	False	I went to a park and I set on a bench. 	[0.78758717, 0.5, 0.5, 0.5, 0.5]
10	5	False	False	False	I didn't notice that my wallet felt. 	[]
10	6	False	True	False	A man came to me from behind giving me back my wallet.	[0.85424757, 0.7956396, 0.5, 0.5, 0.5, 0.5, 0.5]
10	7	False	True	True	Thats a sweet man, 	[0.81150025, 0.5, 0.5, 0.5, 0.5, 0.5, 0.5, 0.5]
10	8	False	True	True	I hope you acknowledged his kind gesture. 	[0.79413784, 0.5, 0.5, 0.5, 0.5, 0.5, 0.5, 0.5, 0.5]
10	9	False	False	False	Yes, 	[]
10	10	False	True	False	I did. 	[0.8521549, 0.84531343, 0.72371244, 0.8208682, 0.5, 0.5, 0.5, 0.5, 0.5, 0.5, 0.5]
10	11	False	True	False	I was so grateful because I have a lot of money in my wallet.	[0.79943645, 0.5, 0.5, 0.5, 0.5, 0.5, 0.5, 0.5, 0.5, 0.5, 0.5, 0.5]
10	12	False	True	True	Their aren't that many well rounded people in the world these days so when you see one you should always show appreciation! 	[0.83999026, 0.8550497, 0.84961194, 0.86271584, 0.83532655, 0.5, 0.5, 0.5, 0.5, 0.5, 0.5, 0.5, 0.5]
11	0	True	False	False	I got recently got three rejection letters for 3 different jobs in a matter of a week and a half. 	[]
11	1	True	True	False	That was a painful experience. 	[]
11	2	False	False	False	People get rejected all the time but it shouldn't be an excuse to let it dissuade you from reaching your goals.	[]
11	3	False	True	True	What happened?	[0.81732416, 0.5, 0.5, 0.5]
11	4	False	False	False	Got rejected from a place I wanted to work, 	[]
11	5	False	False	False	not once but three times 	[]
11	6	False	False	True	I am sorry to hear that. 	[]
11	7	False	False	True	I hope you find a better opportunity. 	[]
11	8	False	True	True	Did you know why they rejected you?	[0.859005, 0.82446766, 0.85377914, 0.5, 0.5, 0.5, 0.5, 0.5, 0.5]
11	9	False	False	False	Thanks, 	[]
11	10	False	False	False	they gave me the same generic lines you always hear. 	[]
12	0	True	True	False	I had my entire house boarded up when the hurricane came.	[]
12	1	False	True	False	I had to board my entire house when the hurricane was coming.	[0.78398937, 0.84588426]
12	2	False	False	True	WOW! 	[]
12	3	False	False	True	Did it do any damage?	[]
12	4	False	False	False	No luckily the house was ok.	[]
12	5	False	False	True	That is great. 	[]
12	6	False	False	True	I would have been scared to death. 	[]
12	7	False	False	True	Was it recent?	[]
13	0	True	False	False	one time when I was in preschool , I had to write on the board. 	[]
13	1	True	True	False	when I got up , my pants fell down in front of the class , that embarassed me	[]
13	2	False	False	False	Once when I was in preschool, 	[]
13	3	False	True	False	my pants fell down in front of the whole class, 	[0.78106683, 0.5, 0.5, 0.5]
13	4	False	False	False	I was so embarassed	[]
13	5	False	False	True	haha yeah that would be very bad !	[]
13	6	False	False	False	It was, 	[]
13	7	False	True	False	I almost cried cause everyone was laughing at me	[0.82955444, 0.8654393, 0.8589668, 0.5687791, 0.5, 0.5, 0.5, 0.5]
13	8	False	True	True	Oh no , sorry to hear that happened to you :(	[0.72721446, 0.5, 0.5, 0.5, 0.5, 0.5, 0.5, 0.5, 0.5]
14	0	True	True	False	I am so upset and mad. 	[]
14	1	True	False	False	I cant believe what has happened!	[]
14	2	False	False	False	I never thought things would go like this.	[]
14	3	False	False	True	What happened for you to feel that way?	[]
14	4	False	False	False	I was at the beach and a hurricane changed track and was coming straight at us. 	[]
14	5	False	True	False	My boyfriend didnt want to leave because we were on the second day only of our vacation.	[0.8330999, 0.86469835, 0.5, 0.5, 0.5, 0.5]
14	6	False	False	True	Oh that does sound terrible. 	[]
14	7	False	False	True	What did you guys decide to do?	[]
14	8	False	False	False	Well we ended up leaving I was too scared to stay and was really upset.	[]
15	0	True	True	False	Last year a tree fell on my house while my family was at home. 	[]
15	1	True	False	False	The tree broke through the ceiling just a few feet away from my daughter. 	[]
15	2	True	True	False	The experience was terrifying.	[]
15	3	False	False	False	What a difference a year makes. 	[]
15	4	False	True	False	Last year one evening my family was at home when a tree fell on the house and broke through the ceiling.	[0.8545929, 0.8595492, 0.5, 0.5, 0.5]
15	5	False	True	True	That's very scary. 	[0.7945473, 0.5, 0.5, 0.5, 0.5, 0.5]
15	6	False	False	True	I hope no one got hurt.	[]
15	7	False	False	False	We were OK, 	[]
15	8	False	True	False	though the tree broke through only a few feet away from my daughter.	[0.8534757, 0.61410534, 0.5, 0.5, 0.5, 0.5, 0.5, 0.5, 0.5]
15	9	False	False	True	So happy everyone was fine!! 	[]
15	10	False	False	True	Everything else can be fixed.	[]
15	11	False	False	False	Indeed. 	[]
15	12	False	False	False	We were out of the house for five months while repairs were being done, 	[]
15	13	False	False	False	but now the house is better than ever.	[]
15	14	False	False	True	So good to hear. 	[]
15	15	False	False	True	Might want to trim some trees lol	[]
16	0	True	True	False	Last week , I was watching the world cup , and watched croatia win from russia	[]
16	1	False	True	False	So last week we were watching the world cup, 	[0.83916944, 0.79067904]
16	2	False	False	False	and lo and behold, 	[]
16	3	False	False	False	Croatia beat the host country, 	[]
16	4	False	False	False	Russia	[]
16	5	False	False	True	I saw that game. 	[]
16	6	False	False	True	They won on penalty kicks!	[]
16	7	False	True	False	Yes! 	[0.7972384, 0.5, 0.5, 0.5, 0.5, 0.5, 0.5, 0.5]
16	8	False	False	False	Both countries were not about to let each other win	[]
16	9	False	False	True	It was very tense. 	[]
16	10	False	False	True	The other game with England and Sweden was not nearly as nerve-wracking.	[]
16	11	False	False	False	You're right. 	[]
16	12	False	False	False	I prefer nerve-wrecking matches. 	[]
16	13	False	False	False	When both teams are great, 	[]
16	14	False	False	False	the tension really builds.	[]
17	0	True	True	False	I have someone always asking me questions about how to use mobile.	[]
17	1	False	False	False	Hi, 	[]
17	2	False	True	False	I have a co work always asking me questions about how to use her mobile. 	[0.7637358, 0.5, 0.5]
17	3	False	False	False	It is almost always the same questions.	[]
17	4	False	True	True	It must be so frustrating to have to answer the same thing over and over. 	[0.82834554, 0.8013316, 0.8215309, 0.6370611, 0.8179629]
17	5	False	False	True	Is she older?	[]
17	6	False	False	False	Yes, 	[]
17	7	False	False	False	she is. 	[]
17	8	False	True	False	She is telling that all the cell phone that she has been using have deleting her contacts.	[0.7791634, 0.5, 0.5, 0.5, 0.5, 0.5, 0.5, 0.5, 0.5]
17	9	False	True	True	My aunt does the same thing! 	[0.74983525, 0.5, 0.5, 0.5, 0.5, 0.5, 0.5, 0.5, 0.5, 0.5]
17	10	False	False	True	I think what she is doing is accidentally deleting texts, 	[]
17	11	False	False	True	and she doesn't understand how to check her contacts list. 	[]
17	12	False	False	True	What do you think is happening with your co-worker?	[]
18	0	True	False	False	I spent all weekend working on my truck to fix a miss in the engine. 	[]
18	1	True	False	False	Despite spending over $200 in parts , it didn't do a thing to fix the miss.	[]
18	2	False	False	False	I worked on my truck all weekend. 	[]
18	3	False	False	False	Spent $215 on parts and a special tool. 	[]
18	4	False	False	False	Still did not fix the miss in the engine.	[]
18	5	False	True	True	What is the problem with the engine?	[0.6931816, 0.5, 0.5, 0.5, 0.5, 0.5]
18	6	False	False	False	It has a miss. 	[]
18	7	False	True	False	Sometimes when you are driving it sputters and jerks and barely has any power. 	[0.85791665, 0.8288917, 0.8414946, 0.74990344, 0.5, 0.5, 0.5, 0.5]
18	8	False	False	False	Other times it drives just fine. 	[]
18	9	False	False	False	I have replaced so many things on it and nothing makes a difference for very long.	[]
18	10	False	False	True	Sorry to hear that. 	[]
18	11	False	False	True	I hope you find what is the problem with the engine.	[]
19	0	True	True	False	A few years ago , my marriage broke up , and I found myself living alone for the first time in my life. 	[]
19	1	True	True	False	Though I eventually grew accustomed to the solitude , it took a while to get used to it.	[]
19	2	False	True	False	I found myself divorced a few years ago, 	[0.86223555, 0.85938984, 0.84978855]
19	3	False	False	False	and for the first time in my life, 	[]
19	4	False	True	False	I was living alone.	[0.8111651, 0.5, 0.5, 0.5, 0.5]
19	5	False	True	True	I felt sad and depressed due to my insecurities and felt rejected from society	[0.8719555, 0.83363616, 0.5, 0.5, 0.5, 0.5]
19	6	False	False	False	Yes, 	[]
19	7	False	True	False	I felt that way for a while. 	[0.85403043, 0.796094, 0.5, 0.5, 0.5, 0.5, 0.5, 0.5]
19	8	False	True	False	But then I grew used to the solitude.	[0.8254317, 0.8615997, 0.5, 0.5, 0.5, 0.5, 0.5, 0.5, 0.5]
19	9	False	False	True	The problem is I don't think you can grew out of my specific insecurity.	[]
20	0	True	True	False	I felt proud when I had accomplished a dream that I wanted to do for a long time. 	[]
20	1	False	True	False	I felt proud when I had accomplished a dream that I wanted to do for a long time. 	[0.8483199, 0.7786478]
20	2	False	False	False	It was absailing!!	[]
20	3	False	False	True	I'm not familiar with abseiling, 	[]
20	4	False	True	True	but I'm glad that you felt good about it.	[0.854745, 0.84719276, 0.5, 0.5, 0.5]
20	5	False	True	False	absailing, 	[0.87053186, 0.8351284, 0.7335934, 0.5, 0.5, 0.5]
20	6	False	False	False	its when you rappeling down a building. 	[]
20	7	False	True	False	What have you down that amazing?	[0.78339297, 0.5, 0.5, 0.5, 0.5, 0.5, 0.5, 0.5]
20	8	False	False	True	Oh, 	[]
20	9	False	True	True	I see. 	[0.8336967, 0.86663085, 0.8697456, 0.710654, 0.5, 0.5, 0.5, 0.5, 0.5, 0.5]
20	10	False	False	True	No, 	[]
20	11	False	False	True	I've never done that.	[]
20	12	False	False	False	so what have you done?	[]
21	0	True	True	False	When I spend time with my father outside by the fire when we are camping.	[]
21	1	False	False	False	Hello	[]
21	2	False	False	True	Hello! 	[]
21	3	False	False	True	I am in such a good mood since I got my new home.	[]
21	4	False	True	False	Funny - we just built a house where we used to go camping when I was a kid. 	[0.82986957, 0.85451806, 0.5, 0.5, 0.5]
21	5	False	False	True	I have a ton of backyard space that we have plans for. 	[]
21	6	False	False	True	Camping would be a fun one.	[]
21	7	False	False	False	That's wonderful. 	[]
21	8	False	False	False	Do you have any plans to have a fire? 	[]
21	9	False	False	True	I want to look in to getting a nice fire pit for the house.	[]
22	0	True	True	False	I was so happy when I moved in to my new home. 	[]
22	1	True	True	False	My girlfriend and I have been saving for awhile and we finally got the keys last month. 	[]
22	2	True	False	False	Now we can finally move on with our life plans.	[]
22	3	False	True	False	Planning out my new home has turned out to be a blast!	[0.80106103, 0.8410355, 0.8081289, 0.5]
22	4	False	False	True	What kind of house are you building? 	[]
22	5	False	True	False	I just moved in so it is already built. 	[0.69583994, 0.5, 0.5, 0.5, 0.5, 0.5]
22	6	False	False	False	Just working on planning out decorating and appliances and such.	[]
22	7	False	False	True	That sounds great. 	[]
22	8	False	True	True	What are you most excited for? 	[0.81448346, 0.86028385, 0.8299589, 0.5, 0.5, 0.5, 0.5, 0.5, 0.5]
22	9	False	True	False	I think I am most excited for all the space I have. 	[0.7092679, 0.5, 0.5, 0.5, 0.5, 0.5, 0.5, 0.5, 0.5, 0.5]
22	10	False	False	False	I can have friends over and not feel cramped.	[]
23	0	True	True	False	I went to a party and it was real bad. 	[]
23	1	False	False	False	I never took a drink before and my friends were all over me to take a drink	[]
23	2	False	True	True	Why did you feel guilty for taking a drink?	[0.69463724, 0.5, 0.5]
23	3	False	True	False	It was not my thing and the moment I took I did wrong. 	[0.81062746, 0.8547736, 0.84040135, 0.5]
23	4	False	False	False	Later in the night I started feeling bad.	[]
23	5	False	False	True	I can understand. 	[]
23	6	False	True	True	I am not a big drinker myself, 	[0.7304553, 0.81397635, 0.8398937, 0.8354747, 0.7592488, 0.5, 0.5]
23	7	False	False	True	but I wouldn't feel guilty about it. 	[]
23	8	False	False	True	 Not unless you promised someone you wouldn't drink.	[]
23	9	False	True	False	Yeah I did to my mum and dad...When I started vomiting I mess my dress and mum knew. 	[0.87348235, 0.857351, 0.8303826, 0.8515298, 0.5, 0.5, 0.5, 0.5, 0.5, 0.5]
23	10	False	False	True	Oh yea I can understand that then... 	[]
23	11	False	False	True	Well I am sure you learned your lesson, 	[]
23	12	False	False	True	right?	[]
23	13	False	False	False	Yeah bad...anyway bye...Thanks for the chat. 	[]
24	0	True	False	False	After learning my husband of only 4 weeks was cheating on me I did the same to him. 	[]
24	1	True	True	False	Not only was it before our marriage but I had found texts of him contacting her for sex after. 	[]
24	2	True	True	False	To make it worse I slept with a close family friend of his.	[]
24	3	False	False	False	I was only married for 4 weeks when I learned my husband was having an affair and ongoing after the wedding. 	[]
24	4	False	False	False	I got him back by sleeping with a close family friend. 	[]
24	5	False	True	False	I felt guilty and ashamed because it was out of character.	[0.7231444, 0.5, 0.5, 0.5, 0.5, 0.5]
24	6	False	True	True	Yeah that sounds really sad. 	[0.78402615, 0.5, 0.5, 0.5, 0.5, 0.5, 0.5]
24	7	False	True	True	I am sorry for what you went through. 	[0.8075614, 0.5, 0.5, 0.5, 0.5, 0.5, 0.5, 0.5]
24	8	False	False	False	Well I choose to stay and work it out, 	[]
24	9	False	False	False	but I never told him. 	[]
24	10	False	False	False	It has been 3 years.	[]
24	11	False	False	True	Yeah maybe that was a good decision that you made. 	[]
24	12	False	False	False	Well I thought I would be feel better but because I am not the cheating kind, 	[]
24	13	False	True	False	I still feel guilty.	[0.85318404, 0.8645884, 0.78924865, 0.5, 0.5, 0.5, 0.5, 0.5, 0.5, 0.5, 0.5, 0.5, 0.5, 0.5]
25	0	True	True	False	when I was younger , my parents picked me up from work with a new car , which really surprised me , I was so excited to have my own car!	[]
25	1	False	False	False	When I was working my first job, 	[]
25	2	False	True	False	my parents picked me up in my new car, 	[0.84937316, 0.8544768, 0.5]
25	3	False	True	False	I was very surprised, 	[0.7067999, 0.5, 0.5, 0.5]
25	4	False	False	False	i thought I was gonna have to buy my own car	[]
25	5	False	True	True	wow, 	[0.8342836, 0.5, 0.5, 0.5, 0.5, 0.5]
25	6	False	False	True	that was so awesome of them!	[]
25	7	False	False	False	Yeah it really was, 	[]
25	8	False	False	False	I am still very thankful of them	[]
25	9	False	False	True	I had to buy my first car and it wasn't until I was 21 that I could afford it. 	[]
26	0	True	True	False	I get wistful remembering my high school days.	[]
26	1	False	True	False	I'm nearing 40 and I find myself thinking a lot about my teen years and early twenties. 	[0.80928725, 0.5]
26	2	False	False	False	The friends I had then and the fun we had.	[]
26	3	False	True	True	That is where I am still at, 	[0.4722263, 0.5, 0.5, 0.5]
26	4	False	False	True	I am scared I will have regrets when I get older	[]
26	5	False	False	False	I don'	[]
26	6	False	False	True	That is good, 	[]
26	7	False	False	True	I am glad you have no regrets!	[]
27	0	True	True	False	Last year I placed an article in an academic journal. 	[]
27	1	True	True	False	This was the first time in a while that I had been able to do this , and it made me feel better about myself.	[]
27	2	False	False	False	A year ago I spent a lot of time doing research for an article. 	[]
27	3	False	True	False	Then a top journal accepted it for publication.	[0.7104648, 0.5, 0.5, 0.5]
27	4	False	False	True	what was the topic	[]
27	5	False	False	False	It was about the medieval poet Geoffrey Chaucer.	[]
27	6	False	False	True	I'm not familiar with him where is he from	[]
27	7	False	True	False	He was an English poet in the fourteenth century,	[0.730163, 0.5, 0.5, 0.5, 0.5, 0.5, 0.5, 0.5]
27	8	False	True	True	and how did you learn about him	[0.85594434, 0.86112994, 0.8529682, 0.81331503, 0.5, 0.5, 0.5, 0.5, 0.5]
28	0	True	True	False	I get irritated with a coworker that gets on my nerves all the time by coming and bothering me smelling like smoke and trying to chat itu p	[]
28	1	False	False	False	Do you have any irritating coworkers?	[]
28	2	False	False	True	Yes, 	[]
28	3	False	False	True	I think that everyone does! 	[]
28	4	False	False	True	What about you?	[]
28	5	False	True	False	yes a few that drive me nuts. 	[0.6855834, 0.5, 0.5, 0.5, 0.5, 0.5]
28	6	False	True	False	the janitor is the worst	[0.7761503, 0.5, 0.5, 0.5, 0.5, 0.5, 0.5]
28	7	False	False	True	That's too bad. 	[]
28	8	False	False	True	Our janitor is very friendly.	[]
28	9	False	True	False	she comes in my office smelling like smoke trying to chat it up rather than do her job. 	[0.8268303, 0.84825456, 0.5, 0.5, 0.5, 0.5, 0.5, 0.5, 0.5, 0.5]
29	0	True	True	False	I broke a statuette offered by grandmother to my sister.	[]
29	1	False	False	False	Hi, 	[]
29	2	False	True	False	I broke a statuette offered by grandmother to my sister. 	[0.8435707, 0.8535651, 0.7929989]
29	3	False	True	False	It was a very important object for my sister.	[0.83317745, 0.70371825, 0.5, 0.5]
29	4	False	False	True	Is it not better you replace it with same type of statuette,at a grocery store?	[]
29	5	False	False	False	No, 	[]
29	6	False	False	False	it is not possible. 	[]
29	7	False	True	False	It is old statuette given by the mother of my grandmother.	[0.7125881, 0.5, 0.5, 0.5, 0.5, 0.5, 0.5, 0.5]
29	8	False	False	True	The mother of your grand mother ,that means your great grand mother ! Well you can search through her archives	[]
30	0	True	True	False	I ordered for French fries  ,bit was served burger ,that pissed me off!	[]
30	1	False	False	False	I could not tolerate the waiters insensitivity,that's poor service indeed!	[]
30	2	False	False	True	What happened?	[]
30	3	False	False	False	Imagine ,I requested a French fries ,but was served burger instead!	[]
30	4	False	False	True	It is very bad service. 	[]
30	5	False	False	True	What did you do? 	[]
30	6	False	False	True	Did you complain to the manager?	[]
