conv_id	clause_no	context?	emotion?	chatbot?	clause	prob
517	3	False	False	False	Now I can't work	[]
517	4	False	True	True	Oh no! 	[0.8393751, 0.85357296, 0.5, 0.5, 0.5]
517	5	False	False	True	I'm sorry to hear that. 	[]
517	6	False	False	True	How deid it happen?	[]
517	7	False	False	False	Slipped on a wet floor while hurrying to get to a patient. 	[]
517	8	False	True	False	There was no sign.	[0.79752386, 0.5, 0.5, 0.5, 0.5, 0.5, 0.5, 0.5, 0.5]
517	9	False	True	True	Are you going to sue? 	[0.8629005, 0.7921791, 0.5, 0.5, 0.5, 0.5, 0.5, 0.5, 0.5, 0.5]
517	10	False	False	True	You could get a whole new leg!	[]
518	0	True	False	False	Sometimes I just eat because I know there is food in the kitchen. 	[]
518	1	True	False	False	I feel bad.	[]
518	2	False	False	False	I am trying my best to go on a diet. 	[]
518	3	False	False	False	It's not going well.	[]
518	4	False	False	True	How much would you like to lose?	[]
518	5	False	False	False	20 pounds. 	[]
518	6	False	False	False	I always eat just because I have food. 	[]
518	7	False	False	False	Maybe if I bought less food, 	[]
518	8	False	False	False	it would be easier. 	[]
518	9	False	False	True	Sounds like a plan! 	[]
518	10	False	True	True	You can also try to see if there is less calorie version of foods you like.	[0.79377323, 0.5, 0.5, 0.5, 0.5, 0.5, 0.5, 0.5, 0.5, 0.5, 0.5]
518	11	False	True	False	I tried that they don't taste as good. 	[0.8721769, 0.81261164, 0.5, 0.5, 0.5, 0.5, 0.5, 0.5, 0.5, 0.5, 0.5, 0.5]
518	12	False	False	False	I am doomed.	[]
519	0	True	False	False	I try to forget my ex and move on. 	[]
519	1	True	False	False	 But every day I wake up and see several things she bought me and I feel like a sledghammer hit me in the chest and stomach.	[]
519	2	False	True	False	I'm finding it super hard to move on from my last relationship.	[0.85719746, 0.8407494, 0.7512925]
519	3	False	False	True	I know how that can be such a struggle. 	[]
519	4	False	True	True	 How long has it been and why did it end?	[0.857057, 0.76807266, 0.8402339, 0.8213052, 0.5]
519	5	False	False	False	Thanks. 	[]
519	6	False	True	False	 I messed it up by cheating on her. 	[0.80656016, 0.83998257, 0.809471, 0.7758542, 0.8365994, 0.8374868, 0.839013]
519	7	False	True	False	 It's been 5 months	[0.7773364, 0.5, 0.5, 0.5, 0.5, 0.5, 0.5, 0.5]
519	8	False	False	True	Everyone makes mistakes, 	[]
519	9	False	False	True	we live and learn I guess. 	[]
519	10	False	False	True	 If there is no hope of her taking you back, 	[]
519	11	False	False	True	then you have to find a way to move forward, 	[]
519	12	False	True	True	but take the time you need to grieve as it is a loss.	[0.862985, 0.66524976, 0.5, 0.5, 0.5, 0.5, 0.5, 0.5, 0.5, 0.5, 0.5, 0.5, 0.5]
519	13	False	False	False	Thanks.	[]
520	0	True	True	False	My husband just finished taking all 4 parts for the CPA exam. 	[]
520	1	True	False	False	 We found out a few weeks back that he passed all parts and is now a CPA.	[]
520	2	False	True	False	My husband just finished taking all 4 parts of the CPA exam. 	[0.6295818, 0.5, 0.5]
520	3	False	True	False	 It took him almost a year to complete as he'd study for one part, 	[0.7955357, 0.5, 0.5, 0.5]
520	4	False	True	False	take that part, 	[0.8721083, 0.8669404, 0.66318285, 0.5, 0.5]
520	5	False	True	False	then start studying for the next part.	[0.83768845, 0.5, 0.5, 0.5, 0.5, 0.5]
520	6	False	True	True	Nice! 	[0.8527444, 0.8695945, 0.5, 0.5, 0.5, 0.5, 0.5]
520	7	False	True	True	Does he feel pretty confident about it	[0.81734914, 0.6570199, 0.7933771, 0.7924371, 0.8070966, 0.84492695, 0.8325387, 0.8186399]
520	8	False	False	False	Well, 	[]
520	9	False	False	False	he said that he didn't. 	[]
520	10	False	True	False	 But we found out a few weeks ago that he's passed all four parts so now he's a CPA!	[0.7382138, 0.5, 0.5, 0.5, 0.5, 0.5, 0.5, 0.5, 0.5, 0.5, 0.5]
520	11	False	True	True	Awesome! 	[0.7918315, 0.8404001, 0.8306538, 0.65305495, 0.5, 0.5, 0.5, 0.5, 0.5, 0.5, 0.5, 0.5]
520	12	False	True	True	Glad it worked out for him	[0.70187885, 0.5, 0.5, 0.5, 0.5, 0.5, 0.5, 0.5, 0.5, 0.5, 0.5, 0.5, 0.5]
521	0	True	True	False	Our home was broken in to 2 months after we purchased it.	[]
521	1	False	True	False	Have you ever been a victim of a home break in?	[0.87118834, 0.6892997]
521	2	False	False	True	Yes I have actually. 	[]
521	3	False	True	True	It was scary.	[0.85227025, 0.7733935, 0.5, 0.5]
521	4	False	True	False	Our home was broken into 2 months after we purchased it. 	[0.8418306, 0.5, 0.5, 0.5, 0.5]
521	5	False	False	False	Luckily, 	[]
521	6	False	True	False	we were not home at the time. 	[0.8123743, 0.5, 0.5, 0.5, 0.5, 0.5, 0.5]
521	7	False	False	True	Im so sorry to hear that. 	[]
521	8	False	False	True	I was watching a house for a familty member and they're safe was stolen.	[]
521	9	False	True	False	That is so scary! 	[0.8728338, 0.8377761, 0.5, 0.5, 0.5, 0.5, 0.5, 0.5, 0.5, 0.5]
521	10	False	False	False	It is so sad to not feel safe in your own home.	[]
522	0	True	True	False	I cant wait to go to the beach.Its time to be sure I am all packed	[]
522	1	False	True	False	I cant wait to go to the beach.Its time to be sure I am all packed.	[0.80622554, 0.851561]
522	2	False	False	True	I love the beach, 	[]
522	3	False	False	True	the gulf is my favorite!	[]
522	4	False	False	False	I have never been but all up and down east coast 	[]
522	5	False	False	True	The Atlantic is not so bad!	[]
523	0	True	True	False	My grandmother passed away when I was 30. 	[]
523	1	True	False	False	 She really didn't get to know my girls very much at all.	[]
523	2	False	True	False	My grandmother passed away about 10 years ago. 	[0.8520854, 0.76604635, 0.85290223]
523	3	False	True	False	 I really miss her, 	[0.82820815, 0.83545595, 0.5, 0.5]
523	4	False	False	False	she pretty much was the only female influence I had growing up.	[]
523	5	False	True	True	Sorry to hear that. 	[0.85302675, 0.8463177, 0.80875087, 0.798487, 0.83742565, 0.8171216]
523	6	False	True	True	 My grandmother is all I have left. 	[0.7318709, 0.5, 0.5, 0.5, 0.5, 0.5, 0.5]
523	7	False	True	True	Grandpa passed 1 month ago	[0.79904306, 0.8460845, 0.85584444, 0.82101077, 0.82415247, 0.79466003, 0.82379717, 0.8574577]
523	8	False	True	False	My grandpa passed a few years after she did. 	[0.5872293, 0.5, 0.5, 0.5, 0.5, 0.5, 0.5, 0.5, 0.5]
523	9	False	True	False	 They'd been married for 70+years. 	[0.7762939, 0.8657485, 0.7823662, 0.5, 0.5, 0.5, 0.5, 0.5, 0.5, 0.5]
523	10	False	True	False	 Neither of them were able to get to know my daughters very much at all.	[0.83463514, 0.79076123, 0.5, 0.5, 0.5, 0.5, 0.5, 0.5, 0.5, 0.5, 0.5]
523	11	False	True	True	How old are your daughters	[0.73667765, 0.8519586, 0.5, 0.5, 0.5, 0.5, 0.5, 0.5, 0.5, 0.5, 0.5, 0.5]
524	0	True	True	False	I'm 99% positive I can handle myself in a street fight. 	[]
524	1	True	True	False	 I've wrestled for 4 years and boxed for 2. 	[]
524	2	True	True	False	 I've sparred with state champions and got a couple of good shots in. 	[]
524	3	True	False	False	 I've also been in a fight where I was outnumbered by 2. 	[]
524	4	True	True	False	 Got my butt kicked but I learned from it.	[]
524	5	False	False	False	One time I was outside a bar and got my butt kicked by 3 guys in a streetfight. 	[]
524	6	False	True	False	 I held my own pretty well until they got me with a couple of beer bottles to the face. 	[0.8274311, 0.5, 0.5, 0.5, 0.5, 0.5, 0.5]
524	7	False	False	False	 I never went down. 	[]
524	8	False	True	False	 So I'm positive I can handle anyone who tries acting tough around me	[0.8294731, 0.76145136, 0.5, 0.5, 0.5, 0.5, 0.5, 0.5, 0.5]
524	9	False	False	True	Wow - were you nervous or scared at all? 	[]
524	10	False	False	True	 Did the police get involved?	[]
524	11	False	False	False	I didn't have time to be scared lmao it happend so fast I just reacted...police got there when half my shirt was soaked in blood haha	[]
524	12	False	False	True	Oh no! 	[]
524	13	False	False	True	 Did you have to go to the hospital to get stitches or anything like that?	[]
524	14	False	False	False	Yes, 	[]
524	15	False	False	False	6 stitches total on my face and head. 	[]
524	16	False	True	False	But got a lot of free drugs so it was all good	[0.791641, 0.5, 0.5, 0.5, 0.5, 0.5, 0.5, 0.5, 0.5, 0.5, 0.5, 0.5, 0.5, 0.5, 0.5, 0.5, 0.5]
525	0	True	False	False	Once I got a big gift in my mail. 	[]
525	1	True	False	False	It was from an anonymous person. 	[]
525	2	True	False	False	I never found out who gave it to me.	[]
525	3	False	True	False	Once I got a big gift in my mail. 	[0.79874945, 0.5, 0.5, 0.5]
525	4	False	False	False	It was from an anonymous person. 	[]
525	5	False	True	False	I never found out who gave it to me.	[0.75004697, 0.5, 0.5, 0.5, 0.5, 0.5]
525	6	False	False	True	That is fun! 	[]
525	7	False	False	True	What was it?	[]
525	8	False	False	False	It was a stuffed teddy bear. 	[]
525	9	False	False	False	it was cute.	[]
525	10	False	True	True	What a neat mystery. 	[0.85458666, 0.75401604, 0.5, 0.5, 0.5, 0.5, 0.5, 0.5, 0.5, 0.5, 0.5]
525	11	False	False	True	I bet you wish you could thank them though. 	[]
525	12	False	False	False	Yes, 	[]
525	13	False	False	False	I do. 	[]
525	14	False	False	False	I tried to find out who that person was. 	[]
525	15	False	False	False	never found out though.	[]
526	0	True	False	False	I just lost my job , and I've got too many bills.	[]
526	1	False	False	False	I just lost my job, 	[]
526	2	False	False	False	and I've got too many bills	[]
526	3	False	False	True	Oh no I'm sorry about that, 	[]
526	4	False	True	True	do you have any family that can help?	[0.8358728, 0.8648802, 0.87159014, 0.792757, 0.5]
526	5	False	False	False	I do, 	[]
526	6	False	False	False	but they're kinda living paycheck to paycheck themselves.	[]
526	7	False	True	True	Do you have any leads on any new jobs?	[0.6856305, 0.5, 0.5, 0.5, 0.5, 0.5, 0.5, 0.5]
527	0	True	True	False	One time I went to a restaurant with all my friends and I forgot to invite one of my close friends. 	[]
527	1	True	True	False	I felt so bad!	[]
527	2	False	True	False	There was this time that I went to eat with all my friends for a special event and I forgot to invite one of my closest friends.I felt horrible	[0.87141865, 0.8043086, 0.5]
527	3	False	False	True	Oh no. 	[]
527	4	False	False	True	Did you talk it out with them?	[]
527	5	False	False	False	Yep I did! 	[]
527	6	False	False	False	He was totally okay with it. 	[]
527	7	False	True	False	I ended up buying him lunch because I felt so bad	[0.820095, 0.8477426, 0.8399489, 0.8428549, 0.8431497, 0.5, 0.5, 0.5]
527	8	False	False	True	That's nice. 	[]
527	9	False	False	True	Everyone makes mistakes. 	[]
527	10	False	False	True	Glad he was forgiving!	[]
527	11	False	False	False	He was! 	[]
527	12	False	False	False	He's a really good guy honestly, 	[]
527	13	False	False	False	and we've gotten closer since then	[]
528	0	True	False	False	My friend woke up late and missed the final exam. 	[]
528	1	True	True	False	Turns out he helped a blind lady get home.	[]
528	2	False	False	False	My friend woke up late and missed the final exam. 	[]
528	3	False	True	False	Turns out he helped a blind lady get home.	[0.8321632, 0.86195457, 0.5, 0.5]
528	4	False	True	True	That was noble	[0.8191733, 0.859305, 0.7781799, 0.5, 0.5]
528	5	False	False	False	It was! 	[]
528	6	False	True	False	He ended up failing final but luckily his previous exams were good enough.	[0.6811102, 0.5, 0.5, 0.5, 0.5, 0.5, 0.5]
528	7	False	True	True	I guess when you do that well in school, 	[0.7797358, 0.78049, 0.7952671, 0.764612, 0.7956055, 0.7976863, 0.8386634, 0.8184749]
528	8	False	False	True	you can afford to miss a day because of that every once and awhile	[]
529	0	True	True	False	When my dad bought me a truck when I was 18 and I was not expecting it.	[]
529	1	False	True	False	My dad surprised me one morning with a new truck. 	[0.73529893, 0.5]
529	2	False	True	False	I was not expecting it all and it was just a great morning.	[0.7531003, 0.5, 0.5]
529	3	False	False	True	That is an awesome dad. 	[]
529	4	False	False	True	Do you still have the truck?	[]
529	5	False	False	False	No, 	[]
529	6	False	False	False	it broke down but it lasted for over a decade	[]
529	7	False	False	True	A decade is great use of it. 	[]
529	8	False	False	True	Do you miss it?	[]
530	0	True	True	False	I miss my dog , Baby Girl , poor thing passed away last year after 15 years.	[]
530	1	False	True	False	I miss my dog, 	[0.7238499, 0.5]
530	2	False	False	False	Baby Girl, 	[]
530	3	False	True	False	poor thing passed away last year after 15 years.	[0.8220021, 0.8562552, 0.5, 0.5]
530	4	False	False	True	Oh, 	[]
530	5	False	False	True	that is SO hard. 	[]
530	6	False	False	True	It sounds like she had a long and happy life. 	[]
530	7	False	True	True	I'm sure you miss her so much.	[0.8691004, 0.86790824, 0.78817195, 0.5, 0.5, 0.5, 0.5, 0.5]
530	8	False	False	False	Absolutely she was my favorite pet I ever had,	[]
530	9	False	False	True	What kind of dog was she? 	[]
531	0	True	False	False	My daughter was thrown from her horse a few months back. 	[]
531	1	True	False	False	 We took her to the hospital and it took hours to make sure she was ok. 	[]
531	2	True	False	False	 Those were a long few hours.	[]
531	3	False	False	False	My daughter was thrown from her horse a few months back.	[]
531	4	False	True	True	Oh no! 	[0.8687323, 0.85523754, 0.8264547, 0.5, 0.5]
531	5	False	False	True	Is she okay?	[]
531	6	False	False	False	Yes, 	[]
531	7	False	False	False	but it took hours to come to that determination. 	[]
531	8	False	True	False	 She had to have a CT scan and an xray of her leg/ankle. 	[0.8120897, 0.85262734, 0.84765756, 0.7519726, 0.5, 0.5, 0.5, 0.5, 0.5]
531	9	False	True	False	 She was pretty bruised and was in an air cast for a few weeks with crutches, 	[0.69869685, 0.5, 0.5, 0.5, 0.5, 0.5, 0.5, 0.5, 0.5, 0.5]
531	10	False	False	False	but she's recovered pretty well.	[]
531	11	False	False	True	That's good to hear! 	[]
531	12	False	True	True	How long ago was that?	[0.8355057, 0.8219581, 0.5, 0.5, 0.5, 0.5, 0.5, 0.5, 0.5, 0.5, 0.5, 0.5, 0.5]
532	0	True	True	False	When Argentina won the semi-finals in 2014 I was so excited! 	[]
532	1	True	False	False	I screamed so much!	[]
532	2	False	True	False	Back in the 2014 World Cup I was super excited when Argentina won against the Netherlands in the semi-final. 	[0.74296, 0.5, 0.5]
532	3	False	False	False	It was crazy!	[]
532	4	False	False	True	So I take it you are a soccer fan? 	[]
532	5	False	True	True	 It seems America is finally getting into the sport. 	[0.85412365, 0.68654627, 0.5, 0.5, 0.5, 0.5]
532	6	False	False	True	 Do you play yourself?	[]
532	7	False	True	False	I used to when I was a kid but not since then! 	[0.6556777, 0.5, 0.5, 0.5, 0.5, 0.5, 0.5, 0.5]
532	8	False	True	False	But I have to follow it, 	[0.7792291, 0.5, 0.5, 0.5, 0.5, 0.5, 0.5, 0.5, 0.5]
532	9	False	True	False	I was born in Argentina, 	[0.7325406, 0.5, 0.5, 0.5, 0.5, 0.5, 0.5, 0.5, 0.5, 0.5]
532	10	False	False	False	it's in my blood	[]
532	11	False	True	True	I would imagine so! 	[0.7903157, 0.5, 0.5, 0.5, 0.5, 0.5, 0.5, 0.5, 0.5, 0.5, 0.5, 0.5]
532	12	False	True	True	 Argentina seems like a lovely place to live.	[0.83375156, 0.82449734, 0.83813965, 0.7491797, 0.84890825, 0.8346711, 0.82967365, 0.84106, 0.5, 0.5, 0.5, 0.5, 0.5]
532	13	False	True	False	It really is! 	[0.8663571, 0.75453115, 0.5, 0.5, 0.5, 0.5, 0.5, 0.5, 0.5, 0.5, 0.5, 0.5, 0.5, 0.5]
532	14	False	True	False	And the food is amazing	[0.749503, 0.5, 0.5, 0.5, 0.5, 0.5, 0.5, 0.5, 0.5, 0.5, 0.5, 0.5, 0.5, 0.5, 0.5]
533	0	True	False	False	Might sell my home. 	[]
533	1	True	True	False	It's the home I grew up in.	[]
533	2	False	False	False	Might sell my home. 	[]
533	3	False	True	False	It's the home I grew up in.	[0.85669917, 0.80050135, 0.5, 0.5]
533	4	False	False	True	Oh, 	[]
533	5	False	False	True	wao those a terrible news, 	[]
533	6	False	False	True	is there any way to keep the house?	[]
533	7	False	False	False	I might be asking for a loan. 	[]
533	8	False	False	False	Not sure yet.	[]
533	9	False	False	True	Well, 	[]
533	10	False	False	True	you have to weight your financial situation vs your emotional situation and see if it worth to keep the house, 	[]
533	11	False	True	True	i guess you have so many memories there.	[0.6866339, 0.5, 0.5, 0.5, 0.5, 0.5, 0.5, 0.5, 0.5, 0.5, 0.5, 0.5]
534	0	True	False	False	Our youngest daughter fell down our back stairs and hit her head on the bottom step. 	[]
534	1	True	False	False	 She started throwing up about an hour later and we went to the ER. 	[]
534	2	True	False	False	 	[]
534	3	False	True	False	Our youngest daughter fell down our back stairs when she was about 4 and hit her head.	[0.61648977, 0.5, 0.5, 0.5]
534	4	False	True	True	ALL of y'all must have been so scared! 	[0.7142684, 0.5, 0.5, 0.5, 0.5]
534	5	False	False	True	Was she okay? 	[]
534	6	False	True	True	Any stitches necessary?	[0.8185221, 0.84816664, 0.85983026, 0.7784185, 0.8466865, 0.8488523, 0.86103016]
534	7	False	True	False	She was fine but we did go to the ER because she started vomiting. 	[0.7986908, 0.5, 0.5, 0.5, 0.5, 0.5, 0.5, 0.5]
534	8	False	True	False	 They did a CT scan and she did have a slight concussion, 	[0.812656, 0.5, 0.5, 0.5, 0.5, 0.5, 0.5, 0.5, 0.5]
534	9	False	False	False	but she recovered just fine.	[]
534	10	False	True	True	The vomiting is scary -- so good that y'all got to the ER, 	[0.795227, 0.5, 0.5, 0.5, 0.5, 0.5, 0.5, 0.5, 0.5, 0.5, 0.5]
534	11	False	True	True	and could confirm that she was okay. 	[0.785929, 0.5, 0.5, 0.5, 0.5, 0.5, 0.5, 0.5, 0.5, 0.5, 0.5, 0.5]
534	12	False	True	True	Was she fearful of stairs after that?	[0.8191391, 0.8654469, 0.815779, 0.5, 0.5, 0.5, 0.5, 0.5, 0.5, 0.5, 0.5, 0.5, 0.5]
535	0	True	True	False	I left my home to my neighbor to take care of , when I had to suddenly visit my mom in Canada	[]
535	1	False	True	False	I left my home to my neighbor to take care of, 	[0.8653839, 0.72073567]
535	2	False	False	False	when I had to suddenly visit my mom in Canada	[]
535	3	False	False	True	I'm glad you had someone to take care of it while you were away. 	[]
535	4	False	False	True	Was you mother alright?	[]
535	5	False	False	False	Yes. 	[]
535	6	False	False	False	Seem like she didn't listen to the doctor about taking her meds on time.	[]
535	7	False	False	True	Oh no. 	[]
535	8	False	False	True	Were you able to get things sorted out? 	[]
535	9	False	True	True	We live far away from family and I know how hard it can be especially when there are health concerns. 	[0.7535261, 0.5, 0.5, 0.5, 0.5, 0.5, 0.5, 0.5, 0.5, 0.5]
536	0	True	True	False	I felt very joyful when I found out I got accepted into a good college that I tried hard to get into , plus my friends were already there	[]
536	1	False	True	False	I felt very joyful when I got into a college that I really wanted to go to, 	[0.8460714, 0.7372022]
536	2	False	False	False	plus my friends were there already.	[]
536	3	False	False	True	Ah, 	[]
536	4	False	False	True	congratulations! 	[]
536	5	False	True	True	What a GREAT feeling. 	[0.72737503, 0.5, 0.5, 0.5, 0.5, 0.5]
536	6	False	False	True	Are y'all all still good friends?	[]
536	7	False	False	False	Most of them yes, 	[]
536	8	False	False	False	things in life happen so I am not still in touch with all of them, 	[]
536	9	False	False	False	but oh well.	[]
536	10	False	False	True	You know what, 	[]
536	11	False	False	True	nothing to mourn, 	[]
536	12	False	False	True	really. 	[]
536	13	False	False	True	Life has chapters, 	[]
536	14	False	False	True	you know? 	[]
536	15	False	False	True	It's wonderful you have the memories you do.	[]
537	0	True	False	False	I try not to judge people. 	[]
537	1	True	False	False	And I've never been a saint. 	[]
537	2	True	False	False	But having a naive 15-year-old female cousin gives me some kind of protective inclination to bust up any kind of pedophile or rapist if I get the chance	[]
537	3	False	False	False	I try not to judge often...but if there's one thing I can't stand it's pedophiles..they just make my blood boil	[]
537	4	False	False	True	I watched a movie based off a true story on that once. 	[]
537	5	False	False	True	It was truely a sad story for the little girl and her parents.	[]
537	6	False	True	False	What movie was it	[0.76571095, 0.78851163, 0.8396205, 0.7851452, 0.5, 0.5, 0.5]
537	7	False	False	True	It was a korean movie. 	[]
537	8	False	True	True	Don't recall the name.	[0.75497085, 0.5, 0.5, 0.5, 0.5, 0.5, 0.5, 0.5, 0.5]
538	0	True	False	False	There are 2 cats that come by my home every night. 	[]
538	1	True	True	False	I leave food out for them.	[]
538	2	False	False	False	There are 2 cats that come by my home every night. 	[]
538	3	False	True	False	I leave food out for them.	[0.8645821, 0.7694032, 0.5, 0.5]
538	4	False	True	True	That's pretty sympathetic of you...but aren't you worried they'll start going through your trash	[0.7375836, 0.5, 0.5, 0.5, 0.5]
538	5	False	False	False	They haven't yet. 	[]
538	6	False	False	False	I hope not!	[]
538	7	False	False	True	Do you own any cats or dogs	[]
539	0	True	True	False	My vacation is coming up in a month. 	[]
539	1	True	False	False	I've worked nonstop for 9 months.	[]
539	2	False	True	False	My vacation is coming up in a month. 	[0.82389337, 0.5, 0.5]
539	3	False	False	False	I've worked nonstop for 9 months.	[]
539	4	False	False	True	Wow, 	[]
539	5	False	True	True	I'll bet you're ready for a vacation. 	[0.81535953, 0.5, 0.5, 0.5, 0.5, 0.5]
539	6	False	False	True	Are you going anywhere special?	[]
539	7	False	True	False	Just going up north to Canada. 	[0.87417614, 0.8138787, 0.5, 0.5, 0.5, 0.5, 0.5, 0.5]
539	8	False	True	False	Trying a new change of scene.	[0.65726256, 0.5, 0.5, 0.5, 0.5, 0.5, 0.5, 0.5, 0.5]
539	9	False	False	True	That should be awesome. 	[]
539	10	False	False	True	Do you know anyone in Canada?	[]
540	0	True	True	False	I was flying in to LAX and the Sierra Nevada Mountains below me made me feel like I was coming home.	[]
540	1	False	False	False	I flew back to California a few weeks ago, 	[]
540	2	False	False	False	it was beautiful flying in over the mountains.	[]
540	3	False	False	True	It sounds beautiful and serene.	[]
540	4	False	False	False	It really is, 	[]
540	5	False	True	False	I miss the Sierra Nevadas very much, 	[0.61552584, 0.5, 0.5, 0.5, 0.5, 0.5]
540	6	False	False	False	have you ever been? 	[]
540	7	False	False	True	No I haven't. 	[]
540	8	False	False	True	But now I want to see.	[]
541	0	True	False	False	Just got offered a car as a gift. 	[]
541	1	True	True	False	I really needed it.	[]
541	2	False	False	False	Just got offered a car as a gift. 	[]
541	3	False	True	False	I really needed it.	[0.8488524, 0.8131537, 0.5, 0.5]
541	4	False	False	True	What an amazing gift to be given! 	[]
541	5	False	False	True	 That truly sounds like a blessing for you.	[]
541	6	False	False	False	It is! 	[]
541	7	False	True	False	The person is very kind to have reached out like that.	[0.7502543, 0.5, 0.5, 0.5, 0.5, 0.5, 0.5, 0.5]
541	8	False	True	True	For sure! 	[0.7781724, 0.5, 0.5, 0.5, 0.5, 0.5, 0.5, 0.5, 0.5]
541	9	False	False	True	 Did you accept the gift?	[]
542	0	True	True	False	My mother in law always lies and exaggerates everything. 	[]
542	1	True	True	False	 It's very frustrating and causes fights between us.	[]
542	2	False	True	False	My mother in law always lies and exaggerates things. 	[0.72459525, 0.5, 0.5]
542	3	False	False	False	 Sometimes the same story is told two different ways to both my husband and I.	[]
542	4	False	False	True	I'm glad you and your husband communicate enough to know that!	[]
542	5	False	False	False	It's frustrating though, 	[]
542	6	False	False	False	never knowing how she's going to interpret something and then share it with others. 	[]
542	7	False	False	False	 Some of the things she's told our kids have been just horrible.	[]
542	8	False	False	True	What do you say to your kids to deal with it?	[]
543	0	True	True	False	My wife is at the hospital getting checked right now. 	[]
543	1	True	True	False	I think we might be getting good news about a new addition to the family.	[]
543	2	False	True	False	My wife is at the hospital getting checked right now. 	[0.828362, 0.5, 0.5]
543	3	False	True	False	I think we might be getting good news about a new addition to the family.	[0.80802214, 0.7993771, 0.5, 0.5]
543	4	False	False	True	Thats awesome, 	[]
543	5	False	False	True	congratulations for sure	[]
543	6	False	False	False	Thank you so much. 	[]
543	7	False	True	False	I can't wait to get the good news from her. 	[0.8653853, 0.783605, 0.5, 0.5, 0.5, 0.5, 0.5, 0.5]
543	8	False	False	True	I am sure you are both going to be happy	[]
544	0	True	True	False	When my brother got suspended from high school for something he did not do by a vindictive teach , it really made me angry	[]
544	1	False	False	False	My brother got suspended for something he did not do in high school by a very vindictive teacher.	[]
544	2	False	False	True	Wow. 	[]
544	3	False	False	True	What a mature teacher.	[]
544	4	False	False	False	Yeah she eventually was fired a year later, 	[]
544	5	False	True	False	but it still makes me angry to think about it	[0.814396, 0.8549407, 0.5, 0.5, 0.5, 0.5]
544	6	False	False	True	Was the fire related to the incident or did she get in trouble for something else?	[]
545	0	True	False	False	Just came back from a job interview. 	[]
545	1	True	True	False	Seem to hit it off with the interviewer.	[]
545	2	False	False	False	Just came back from a job interview. 	[]
545	3	False	True	False	Seem to hit it off with the interviewer.	[0.8386394, 0.5, 0.5, 0.5]
545	4	False	True	True	That is great! 	[0.6636211, 0.5, 0.5, 0.5, 0.5]
545	5	False	False	True	Have you been looking for a job for long?	[]
545	6	False	False	False	Yep. 	[]
545	7	False	False	False	About half a year.	[]
545	8	False	False	True	I bet it is a good feeling and are looking forward to hearing from them. 	[]
546	0	True	False	False	My dogs passed away 2 years ago. 	[]
546	1	True	False	False	My family adopted me one this past weekend on my birthday.	[]
546	2	False	False	False	My dogs passed away 2 years ago. 	[]
